title,url,image,category,date,content
Researchers link aging with changes in brain networks related to cognition,https://medicalxpress.com/news/2019-07-link-aging-brain-networks-cognition.html,https://3c1703fe8d.site.internapcdn.net/newman/csz/news/325u/2019/9-brain.jpg,Neuroscience,"July 12, 2019","Functional regions within the brain become less distinct and interconnected in the elderly over time, especially in those networks related to attention span and cognition. The finding, published by researchers at Duke-NUS Medical School in The Journal of Neuroscience, adds to current understanding of longitudinal decline in brain network integrity associated with aging.                                                Journal of Neuroscience""We currently live in a rapidly aging society,"" said the study's corresponding author, Associate Professor Juan Helen Zhou, a neuroscientist from the faculty of Duke-NUS' Neuroscience and Behavioural Disorders program. ""Compared to cross-sectional studies, it is vital to understand brain changes over time that underlie both healthy and pathologic aging, in order to inform efforts to slow down cognitive aging.""The human brain contains functionally segregated neuronal networks with dense internal connections and sparse inter-connectivity. aging is thought to be associated with reduced functional specialisation and segregation of these brain networks. human brainJoint senior authors Associate Professor Zhou and Professor Michael Chee, Director of Duke-NUS' Centre for Cognitive Neuroscience, led the research team, collecting data from neuropsychological assessments and functional magnetic resonance imaging (fMRI) brain scans from a cohort of 57 healthy young adults and 72 healthy elderly Singaporeans. Each elderly participant was scanned two to three times during a period of up to four years. The neuropsychological assessments tested participants' ability to process information quickly, focus their attention, remember verbal and visuospatial information, and plan and execute tasks. The fMRI scans measured how brain regions are functionally connected based on low-frequency blood oxygenation level fluctuations over time. Participants were asked to relax with their eyes open and remain still as these were performed. functional magnetic resonanceDr. Joanna Chong, first author of the paper and a Ph.D. graduate from Associate Professor Zhou's lab at Duke-NUS, developed approaches to convert the fMRI images into graphic representations that depict the inter- and intra-network connectedness of each individual's brain. She then compared differences in brain functional networks between the young and elderly participants, and in the elderly over time. networkThe team tracked changes in brain functional networks that affected specific cognitive abilities, such as goal-oriented thought and action, and choosing where to focus attention. As one ages, these networks associated with cognition are less efficient in information transfer, more vulnerable to disturbance, and less distinctive. ""Overall, our research advances understanding of brain network changes over time, underlying cognitive decline in healthy aging,"" said Associate Professor Zhou. ""This can facilitate future work to identify elderly individuals at risk of aging-related disorders or to identify strategies that can preserve cognitive function.""Commenting on the study, Professor Patrick Casey, senior vice dean for research at Duke-NUS, stated, ""aging is a significant risk factor for a variety of chronic diseases in people, including neurodegenerative and cerebrovascular diseases. Governments worldwide are concerned about the public health implications of increasingly aging populations. Basic research such as this plays a vital role in informing efforts to help us stay healthy longer as we live longer lives.""The researchers aim to next examine how various factors, such as genetic and cardiovascular risks, might influence aging-related changes in brain networks. By studying a larger group of healthy young, middle-aged and older adults, they hope to develop better ways to predict cognitive decline.                                                                                                                        brain"
Low-cost Moon mission puts India among lunar pioneers,https://phys.org/news/2019-07-low-cost-moon-mission-india-lunar.html,https://3c1703fe8d.site.internapcdn.net/newman/csz/news/325u/2019/indiaschandr.jpg,Astronomy & Space,"July 12, 2019","India will step up the international space race on Monday when it launches a low-cost mission to become only the fourth country to land a probe on the Moon.                                               Just five days before the 50th anniversary of man's first lunar landing, Chandrayaan-2—or Moon Chariot 2—will blast off from a tropical island off Andhra Pradesh state after a decade-long build-up.The mission will also highlight how far space travel has advanced since Neil Armstrong's giant leap for mankind during the Apollo 11 mission.India has spent about $140 million to get Chandrayaan-2 ready for the 384,400 kilometres (around 240,000 miles) trip from the Satish Dhawan Space Centre to the scheduled landing on the lunar South Pole on September 6.The United States spent about $25 billion—the equivalent of more than $100 billion in current prices—on 15 Apollo missions, including the six that put Armstrong and other astronauts on the Moon. China landed its Chang'e 4 lunar craft in January, and spent $8.4 billion on its entire space programme in 2017, according to international Organisation for Economic Cooperation and Development figures.And Russia—the first country to land an unmanned Moon rocket in 1966—spent more than $20 billion at today's values on lunar missions in the 1960s and 70s.Spiced-up space raceSpiced-up space raceAlmost the entire Chandrayaan-2's orbiter, lander and rover have been designed and made in India.India will use its most powerful rocket launcher, GSLV Mk III, to carry the 2.4 tonne orbiter, which has a mission life of about a year.The spacecraft will carry the 1.4 tonne lander Vikram—which in turn will take the 27-kilogramme (60-pound) rover Pragyan—to a high plain between two craters on the lunar South Pole. Indian Space Research Organisation (ISRO) chief K. Sivan said Vikram's 15-minute final descent ""will be the most terrifying moments as we have never undertaken such a complex mission"".The solar-powered rover can travel up to 500 metres (yards) and is expected to work for one lunar day, the equivalent of 14 Earth days.Sivan said the probe will be looking for signs of water and ""a fossil record of the early solar system"".Despite the relatively small budget, the mission does raise questions about how funds are allocated when the country is still battling hunger and poverty. But national pride is at stake: Prime Minister Narendra Modi has vowed to send a manned mission into orbit by 2022.national prideMost experts say the geo-strategic stakes are small—but that India's low-cost model could win commercial satellite and orbiting deals.""The fundamental question that we should ask ourselves in this context is not whether India should undertake such ambitious space ventures, but whether India can afford to ignore it,"" said K. Kasturirangan, a former ISRO chief.India has to aim to be a leader in space, he added.Rajeswari Pillai Rajagopalan, head of space policy at the Observer Research Foundation, a New Delhi think tank, said Chandrayaan-2 will enhance the nation's reputation ""at a time when the global and particularly, the Asian space programmes are becoming increasingly competitive"".Amitabha Ghosh, a scientist for NASA's Rover mission to Mars, said the benefits of Chandrayaan-2 are huge, compared to its cost.""A spacecraft mission of the complexity of Chandrayaan-2 conveys a message that India is capable of delivering on difficult technology development endeavours,"" said Ghosh.However, some experts say anyone looking for a cheap ticket to space should think of the comfort on low-cost plane rides closer to Earth.spaceScott Hubbard, a former top NASA researcher now with Stanford University, examined the cost-effectiveness of the Indian Mars orbiter against the American Maven mission. Although both launched in 2013, Maven is estimated to have cost 10 times more, but India's Mangalyaan was only designed to last about a year. ""The US mission was required to last two years. That's a big difference in cost,"" said Hubbard. And Mangalyaan's payload was 15 kg, while Maven could carry 65 kg with more sophisticated instruments. mission""So you get what you pay for,"" concluded Hubbard.                                                                                                                                                                        © 2019 AFP                                            "
Timeout declared for Walkie-Talkie on Apple Watch,https://techxplore.com/news/2019-07-timeout-declared-walkie-talkie-apple.html,https://3c1703fe8d.site.internapcdn.net/newman/csz/news/325u/2019/1-applewatch.jpg,Consumer & Gadgets,"July 12, 2019","Pre-iEra, the idea of a Dick Tracy hiding in the corners of a skyscraper, talking to his wrist captured imaginations of children and adults everywhere. Apple did not let us forget. Its Walkie-Talkie app launched last year meant you could chat directly with other Apple Watch users via your wrist.                                              Walkie-Talkie however will have to take a walk and stop talking. Apple has said no to it as a live feature on its Apple Watch, where users could push a button and communicate instantly.Why? Apple was made aware that there was a vulnerability enabling someone to listen in on another user's iPhone without consent. That two-way communication app was at least possibly able to fall victim to eavesdropping.AppleInsider's Mikey Campbell: ""Apple said it was made aware of the bug through its product security reporting service, which allows developers, researchers and others to flag security and privacy issues via email.""AppleInsiderserviceprivacy issuesApple has disabled the feature until such time that it can release a fix.TechCrunch had the much-quoted story that captured the attention of other news sites. TechCrunch Editor-In-Chief Matthew Panzarino posted Apple's statement.TechCrunchTechCrunch""We were just made aware of a vulnerability related to the Walkie-Talkie app on the Apple Watch and have disabled the function as we quickly fix the issue. We apologize to our customers for the inconvenience and will restore the functionality as soon as possible.""aware Apple promptly moved to disable the app and referred to the move as ""the right course of action.""Apple said there was no sign currently  that it was exploited and mentioned that ""specific conditions and sequences of events"" were required to exploit it. As Apple said it would require a specific sequence of events to take place, Benjamin Mayo, 9to5Mac, took that to suggest ""it sounds like the bug was intricate and not something that would be stumbled on by accident."" 9to5MacbugWhat's next?""The company is temporarily disabling the feature entirely until a fix can be made and rolled out to devices,"" said Panzarino. ""The Walkie Talkie App will remain installed on devices, but will not function until it has been updated with the fix.""disabling(Gizmodo, by the way, verified that while the Walkie-Talkie app remains on the Apple Watch, attempts to chat with friends or invite friends to chat were not working, according to Victoria Song on Thursday.)GizmodochatArs Technica's Dan Goodin described what the app does for Apple's watch users: ""The Walkie-Talkie app allows people who accept an invitation to talk with friends in real-time without the hassle of making a phone call. Parties press a button when speaking and release it to hear what the other party says. Apple introduced the feature last year as part of its WatchOS 5 update.""Ars Technicainvitationreal-timeIn June last year, Dieter Bohn in The Verge decribed what he saw in a new app, Walkie-Talkie, which ""lets you send and receive quick voice messages with friends and family.""The VergequickHe walked his readers through how it works. ""You and your friend agree to become Walkie-Talkie buddies (my term, not Apple's). One of you asks to start a Walkie-Talkie chat, and then the other agrees to be your pal. You open Walkie-Talkie and then tap a button to send a message...Once the call is connected, your friend hears a chime and then the message you sent. They can then tap a button on their watchface to reply instantly. Their reply is sent to you instantly, and you can then reply by tapping a button yourself.""Bohn was impressed in how it ""ensures a real-time communication feeling to Walkie-Talkie chats. It's way simpler than previous cellular PTT solutions...And because it's based on Apple's own FaceTime instead of cellular numbers, it works equally well over Wi-Fi and cellular.""Apple can be praised for quickly translating the alert into action to protect customers. In the bigger picture, when so much scrutiny is placed on how major vendors treat user privacy, though, it comes as no surprise that Apple reacted promptly. Sebastian Herrera, a reporter at The Wall Street Journal, remarked that ""Big technology companies are facing heightened scrutiny of their data-privacy practices and their market power.""                                                                                                                        The Wall Street JournalBig                                                © 2019 Science X Network                                            "
Mini-model of Stonehenge reveals how voices would have carried in original ancient monument,https://phys.org/news/2019-07-mini-model-stonehenge-reveals-voices-ancient.html,https://3c1703fe8d.site.internapcdn.net/newman/csz/news/325u/2019/stonehenge.jpg,Other Sciences,"July 12, 2019","A team of researchers at the University of Salford in the U.K. has revealed how voices would have sounded 4,000 years ago inside of the Stonehenge monument. The group made a recording of their efforts and posted the results on SoundCloud.                                               posted the results on SoundCloudStonehenge is, of course, a monument built roughly 5,000 years ago by Neolithic people for unknown reasons—they left behind no written records. In modern times, the monument has become famous the world over, and attracts hundreds of thousands of tourists every year. The researchers explored what a human voice would have sounded like inside the monument during its heyday. To find out, they applied a modern technique that has been used to help architects build concert halls with optimal sound characteristics. The technique involves building a small-scale model of a building prior to construction and blasting sounds at it at 12 times their normal frequency in a sound chamber to overcome the size differences.modern timeshuman voiceconcert hallssoundTo replicate the technique for Stonehenge, the researchers 3-D printed each of the stones and used them to make silicon molds that were then filled with a plaster-polymer mix. Each of the stones was painted and then placed in its original position within the monument. The result was a 1:12 scale model of the original monument—the tallest model stone was just 60 centimeters.Next, the team subjected the model to sound tests in a sound chamber, producing a sound profile for the monument. They then applied the sound profile to the recorded voice of a team member. The researchers claim the voice in the recording sounds like it would have were the team member to have stood in the center of the monument while speaking all those years ago. They note that despite large spaces between the stones, a person's voice would have reverberated around the monument, producing an echoing effect. They also suggest it is not likely that the people who built the monument knew what impact it would have on a speaker's voice, but point out that it seems likely they would have taken advantage of the impressive acoustics.monument                                                © 2019 Science X Network                                            "
Researchers tie metabolic enzyme to obesity and fatty liver disease,https://medicalxpress.com/news/2019-07-metabolic-enzyme-obesity-fatty-liver.html,https://3c1703fe8d.site.internapcdn.net/newman/csz/news/325u/2019/4-clemsonresea.jpg,Medical research,"July 12, 2019","Researchers from Clemson University's Environmental Toxicology Program have published research connecting an enzyme associated with detoxification to obesity and fatty liver disease, especially in males.                                                William Baldwin, professor and graduate program coordinator in the College of Science's department of biological sciences, and members of his laboratory used a novel mouse model developed in their laboratory to study the role of the Cyp2b gene in obesity. Cyp2b is a key enzyme involved in metabolism, particularly in the detoxification of chemicals in the body. Among other results, the research indicates a role for Cyp2b in unsaturated fatty acid metabolism, regardless of diet. Certain chemicals could inhibit Cyp2b, a phenomenon modeled by Cyp2b-null mice.obesitydietmiceThe study titled ""Cyp2b-null male mice are susceptible to diet-induced obesity and perturbations in lipid homeostasis"" was published in the Journal of Nutritional Biochemistry. It is part of a three-year, $362,000 grant Baldwin received from the National Institutes of Health to continue studies on how exposure to chemicals is likely to inhibit our bodies' internal mechanisms. Contributing to the paper were Melissa Heintz, Ramiya Kumar, Meredith Rutledge and Baldwin.Journal of Nutritional Biochemistry""The male Cyp2b-null mice are obese—and much more obese—than the wild-type mice that are also fed a high fat diet,"" Baldwin said.high fat dietThere are several possible implications to human health.""If you are exposed to chemicals that are metabolized by Cyp2b or inhibitors of Cyp2b, this might mean that you are not metabolizing something else in the body that is important,"" Baldwin said. ""In turn, maybe your likelihood of retaining white adipose tissue increases and therefore your likelihood of being obese increases.""In addition, male Cyp2b-null mice had increased fatty liver disease without being fed a high-fat diet.""Cyp2b must be signaling something and telling the fat to go someplace, indicating that Cyp2b has dual roles: metabolizing toxicants and chemicals in the environment and pharmaceuticals, but it is also involved in metabolism of lipids and probably involved in signaling to tell us how to distribute fat,"" Baldwin said.With 40 percent of adults and 18.5 percent of youth in the United States now considered obese, the discovery that enzymes associated with detoxification may play a role in obesity—beyond the compounding effects of diet, exercise and general genetics—is critical.Female Cyp2b-null mice did not show any greater propensity toward obesity, though there were indications that they have a higher rate of liver damage than wild-type female mice.Gene expression was also affected. Cyp2b-null mice fed a normal diet have gene expression profiles similar to wild-type mice fed a high-fat diet.high-fat diet""When the Cyp2b-null mice are fed a regular diet, their livers are acting like they are being fed a high fat diet,"" Baldwin said.Heintz, a third-year Ph.D. candidate in environmental toxicology, said there are still many pathways to explore in this area of research.""You might be healthy but you might be exposing yourself to a chemical in the workplace,"" she said. ""Even though your diet is pretty good, if you are losing this activity of an enzyme in your liver, what you may not have thought would be important may be important in metabolizing fat.""chemicalThis discovery also opens the door to exploring other enzymes that are currently thought to have one role but may also metabolize fat.""Very little work has been done on this one particular enzyme, Cyp2b, and looking at its role in fatty acid metabolism,"" Heintz said. ""It's just one gene and there could be more that do similar things.""""For all the obesity that occurred, the relative levels of fatty liver disease were not as high as we expected,"" Baldwin added. ""We did the study for only 10 weeks, and if we want to study liver disease, we need to go further. We need to study the fatty liver disease phenomenon because that is the problem: 25 percent of the world's population has nonalcoholic fatty liver disease. That's increasing quite a bit.""liverKumar earned a Ph.D. at Clemson and is now a senior clinical process associate with a clinical research company in Bangalore, India. Kumar said future research will show whether chemical inhibitors of these genes, such as plasticizers and pesticides, could also elicit a similar change in metabolism and lead to obesity.""It will help us to plan better treatment regimens for obesity, along with changes in lifestyle and diet,"" Kumar said.This research has the potential to inform how scientists look at a host of metabolic disorders and chronic conditions, all with the goal of increasing human health.""I think it tells us that obesity—and potentially fatty liver disease—is a multi-component disease,"" Baldwin said. ""It is about, first and foremost, eating the wrong foods or eating too much. But we can make it worse by external factors—whether that's chemicals, a lack of exercise or the components of our diets. There are a lot of little pieces to that, and this is one study that indicates that a healthy lifestyle involves a healthy diet, having the right calories and potentially avoiding some chemicals as well.""                                                                                                                        fatty liver diseasehealthy lifestyle"
Researchers image molecules as they change charge states for first time,https://phys.org/news/2019-07-image-molecules-states.html,https://3c1703fe8d.site.internapcdn.net/newman/csz/news/325u/2019/41-researchersi.jpg,Chemistry,"July 12, 2019","A team of researchers from IBM Research–Zurich, ExxonMobil Research and Engineering Company and Universidade de Santiago de Compostela has, for the first time, imaged molecules as they change charge states. In their paper published in the journal Science, the group describes how they created the images and what they saw.                                               ScienceScientists have known for some time that molecules change when they are charged, both in function and structure. But until now, they have not been able to see it in action. In this new effort, the researchers have made images of four molecules—azobenzene, pentacene, TCNQ and porphine—as they underwent changes due to charging. They note that molecular charging is at the very heart of many very important biological processes, such as energy transport and photoconversion—thus, observing what it looks like when it happens is very important.imagesTo create the images, the researchers placed a single molecule on an isolated NaCl film and then used high-resolution atomic force microscopy in a very cold vacuum environment to transfer a single electron from the probe tip to the molecule. Imaging was carried out using carbon monoxide-functionalized tips. Each of the molecules was imaged in four states: positive, neutral, negative and double-negative (adding two electrons).single moleculeThe researchers observed structural changes in all of the molecules, and that each was changed in a different way than the others. With pentacene, for example, the team saw which areas of the molecule became more reactive. With TCNQ, they observed changes in the bonds between the atoms in the molecule—and they also noted that it moved relative to its base. And with porphine, they observed changes to the types of bonds and their lengths. They also noted that porphine, in particular, plays a critical role in biological processing—it is involved in the process of hemoglobin transporting oxygen in living organisms. Being able to see what happens to a molecule as it is charged can help to better understand how the whole transport process works. The team further suggests that using techniques such as imaging molecular charge states will help with the development of new materials and devices—and will improve our understanding of nature in general.molecules                                                © 2019 Science X Network                                            "
