title,url,image,category,date,content
New CRISPR platform expands RNA editing capabilities,https://phys.org/news/2019-07-crispr-platform-rna-capabilities.html,https://3c1703fe8d.site.internapcdn.net/newman/csz/news/325u/2019/newcrisprpla.jpg,Biology,"July 11, 2019","CRISPR-based tools have revolutionized our ability to target disease-linked genetic mutations. CRISPR technology comprises a growing family of tools that can manipulate genes and their expression, including by targeting DNA with the enzymes Cas9 and Cas12 and targeting RNA with the enzyme Cas13. This collection offers different strategies for tackling mutations. Targeting disease-linked mutations in RNA, which is relatively short-lived, would avoid making permanent changes to the genome. In addition, some cell types, such as neurons, are difficult to edit using CRISPR/Cas9-mediated editing, and new strategies are needed to treat devastating diseases that affect the brain.                                               McGovern Institute Investigator and Broad Institute of MIT and Harvard core member Feng Zhang and his team have now developed one such strategy, called RESCUE (RNA Editing for Specific C to U Exchange), described in the journal Science.ScienceZhang and his team, including first co-authors Omar Abudayyeh and Jonathan Gootenberg (both now McGovern Fellows), made use of a deactivated Cas13 to guide RESCUE to targeted cytosine bases on RNA transcripts, and used a novel, evolved, programmable enzyme to convert unwanted cytosine into uridine—thereby directing a change in the RNA instructions. RESCUE builds on REPAIR, a technology developed by Zhang's team that changes adenine bases into inosine in RNA.RESCUE significantly expands the landscape that CRISPR tools can target to include modifiable positions in proteins, such as phosphorylation sites for the first time. Such sites act as on/off switches for protein activity and are notably found in signaling molecules and cancer-linked pathways.""To treat the diversity of genetic changes that cause disease, we need an array of precise technologies to choose from. By developing this new enzyme and combining it with the programmability and precision of CRISPR, we were able to fill a critical gap in the toolbox,"" says Zhang, the James and Patricia Poitras Professor of Neuroscience at MIT. Zhang also has appointments in MIT's departments of Brain and Cognitive Sciences and Biological Engineering.Expanding the reach of RNA editing to new targetsExpanding the reach of RNA editing to new targetsThe previously developed REPAIR platform used the RNA-targeting CRISPR/Cas13 to direct the active domain of an RNA editor, ADAR2, to specific RNA transcripts where it could convert the nucleotide base adenine to inosine, or letters A to I. Since no natural editors exist with alternative activities, Zhang and colleagues took the REPAIR fusion, and evolved it in the lab until it could change cytosine to uridine, or C to U.RESCUE can be guided to any RNA of choice, then perform a C-to-U edit through the evolved ADAR2 component of the platform. The team took the new platform into human cells, showing that they could target natural RNAs in the cell as well as 24 clinically relevant mutations in synthetic RNAs. They then further optimized RESCUE to reduce off-target editing, while minimally disrupting on-target editing.New targets in sightNew targets in sightExpanded targeting by RESCUE means that sites regulating activity and function of many proteins through post-translational modifications, such as phosphorylation, glycosylation, and methylation can now be targeted for editing.A major advantage of RNA editing is its reversibility, in contrast to changes made at the DNA level, which are permanent. Thus, RESCUE could be deployed transiently in situations where a modification may be desirable temporarily, but not permanently. To demonstrate this, the team showed that in human cells, RESCUE can target specific sites in the RNA encoding β-catenin, that are known to be phosphorylated on the protein product, leading to a temporary increase in β-catenin activation and cell growth. If such a change was made permanently, it could predispose cells to uncontrolled cell growth and cancer, but by using RESCUE, transient cell growth could potentially stimulate wound healing in response to acute injuries.human cellsThe researchers also targeted a pathogenic gene variant, APOE4. The APOE4 allele has consistently emerged as a genetic risk factor for the development of late-onset Alzheimer's Disease. Isoform APOE4 differs from APOE2, which is not a risk factor, by just two differences (both C in APOE4 vs. U in APOE2). Zhang and colleagues introduced the risk-associated APOE4 RNA into cells, and showed that RESCUE can convert its signature C's to an APOE2 sequence, essentially converting a risk to a non-risk variant.genetic risk factorTo facilitate additional work that will push RESCUE toward the clinic as well as enable researchers to use RESCUE as a tool to better understand disease-causing mutations, the Zhang lab plans to share the RESCUE system broadly, as they have with previously developed CRISPR tools. The technology will be freely available for academic research through the non-profit plasmid repository Addgene. Additional information can be found on the Zhang lab's webpage.                                                                                                                        "
What happens when you explode a chemical bond?,https://phys.org/news/2019-07-chemical-bond.html,https://3c1703fe8d.site.internapcdn.net/newman/csz/news/325u/2019/6-whathappensw.jpg,Chemistry,"July 11, 2019","On bright summer days, the sunlight all around us is breaking bad by breaking bonds. Chemical bonds.                                               Ultraviolet light shatters the links between atoms in the DNA of our skin cells, potentially causing cancer. UV light also breaks oxygen bonds, eventually creating ozone, and cleaves hydrogen off other molecules to leave behind free radicals that can damage tissue.lightmoleculesUniversity of California, Berkeley, chemists using some of the shortest laser pulses available—one quintillionth of a second—have now been able to resolve the step-by-step process leading to the exploding of a chemical bond, essentially making a movie of the event. They can follow electrons indecisively bouncing around in various states in the molecule before the bond breaks, and the atoms go their separate ways.chemicalbondThe technique, reported last week in the journal Science, will help chemists understand and potentially manipulate chemical reactions stimulated by light, so-called photochemical reactions. Chemists and biologists, in particular, are interested in understanding how large molecules manage to absorb light energy without breaking any bonds, as happens when molecules in the eye absorb light, giving us vision, or molecules in plants absorb light for photosynthesis.Sciencechemical reactionslarge moleculeslight energy""Think about a molecule, rhodopsin, in the eye,"" said first author Yuki Kobayashi, a UC Berkeley doctoral student. ""When light hits the retina, rhodopsin absorbs the visible light, and we can see things because rhodopsin's bond's conformation changes.""visible lightIn fact, when the light energy is absorbed, a bond in rhodopsin twists, instead of breaks, triggering other reactions that result in the perception of light. The technique Kobayashi and his UC Berkeley colleagues, professors Stephen Leone and Daniel Neumark, developed could be used to study in detail how this light absorption leads to twisting after the molecule passes through an excited state called an avoided crossing or conical intersection.excited stateTo prevent the breaking of a bond in DNA, ""you want to redirect the energy from dissociation to just being vibrationally hot. For rhodopsin, you want to redirect the energy from vibrating to a cis-trans isomerization, a twist,"" Kobayashi said. ""These redirections of chemical reactions are happening ubiquitously around us, but we have not seen the actual moment of them before.""Fast laser pulsesFast laser pulsesAttosecond lasers—an attosecond is a billionth of a billionth of a second—have been around for about a decade and are used by scientists to probe very fast reactions. Since most chemical reactions occur rapidly, these fast-pulse lasers are key to ""seeing"" how the electrons that form the chemical bond behave when the bond breaks and/or reforms.Leone, a professor of chemistry and of physics, is an experimentalist who also uses theoretical tools and is a pioneer in using attosecond lasers to probe chemical reactions. He has six of these X-ray and extreme ultraviolet (collectively, XUV) lasers in his UC Berkeley laboratory.Working with one of the simplest of molecules, iodine monobromide (IBr)—which is one iodine atom linked to one bromine atom—the UC Berkeley team hit the molecules with an 8 femtosecond pulse of visible light to excite one of their outermost electrons, then probed them with attosecond laser pulses.Pulsing the attosecond XUV laser at timed intervals of 1.5 femtosecond (a femtosecond is 1,000 attoseconds), much like using a strobe light, the researchers could detect the steps leading to the breakup of the molecules. The high-energy XUV laser was able to explore the excited energy states relative to the molecule's inner electrons, which normally do not participate in chemical reactions.""You are kind of making a movie of the pathways of the electron when it approaches the crossing and the probability of it going along one path or along another,"" Leone said. ""These tools we are developing allow you to look at solids, gases and liquids, but you need the shorter time scales (provided by an attosecond laser). Otherwise, you only see the beginning and the end, and you don't know what else happened in between.""laserThe experiment showed clearly that the outer electrons of IBr, once excited, suddenly see a variety of states or places they could be and explore many of them before deciding which path to take. In this simple molecule, however, all paths lead to the electron settling on either iodine or bromine and the two atoms flying apart.In larger molecules, which the team hopes soon to explore, excited electrons would have more choices, some where the energy goes into a twist, like with rhodopsin, or into molecular vibration without the molecules breaking apart.""In biology, it turns out that evolution has selected things that are extremely effective at absorbing the energy and not breaking a bond,"" Leone said. ""When something goes wrong in your chemistry is when you see diseases cropping up.""                                                                                                                        "
Moon-forming disk discovered around distant planet,https://phys.org/news/2019-07-moon-forming-disk-distant-planet.html,https://3c1703fe8d.site.internapcdn.net/newman/csz/news/325u/2019/moonformingd.jpg,Astronomy & Space,"July 11, 2019","Using Earth's most powerful array of radio telescopes, astronomers have made the first observations of a circumplanetary disk of gas and dust like the one that is believed to have birthed the moons of Jupiter.                                               The find, reported online today in Astrophysical Journal Letters, adds to the intriguing story of planet PDS 70 c, a still-forming gas giant about 370 light years from Earth that was first revealed last month in visible light images.Astrophysical Journal Letterslight yearsUsing the massive 66-antenna Atacama Large Millimeter/submillimeter Array (ALMA) in Chile, Rice University astronomer Andrea Isella and colleagues collected millimeter wave radio signals that revealed the presence of dust grains throughout the star system where PDS 70 c and its sister planet, PDS 70 b, are still forming.star system""Planets form from disks of gas and dust around newly forming stars, and if a planet is large enough, it can form its own disk as it gathers material in its orbit around the star,"" Isella said. ""Jupiter and its moons are a little planetary system within our solar system, for example, and it's believed Jupiter's moons formed from a circumplanetary disk when Jupiter was very young.""starsBut most models of planet formation show that circumplanetary disks disappear within about 10 million years, which means circumplanetary disks haven't existed in our solar system for more than 4 billion years. To look for them elsewhere and gather observational evidence to test theories of planet formation, Isella and colleagues search for very young star systems where they can directly observe disks and the planets still forming inside them. In the new study, Isella and colleagues analyzed observations made by ALMA in 2017.planets""There are a handful of candidate planets that have been detected in disks, but this is a very new field, and they are all still debated,"" Isella said. ""(PDS 70 b and PDS 70 c) are among the most robust because there have been independent observations with different instruments and techniques.""PDS 70 is a dwarf star about three-quarters the mass of the sun. Both of its planets are 5-10 times larger than Jupiter, and the innermost, PDS 70 b, orbits about 1.8 billion miles from the star, roughly the distance from the sun to Uranus. PDS 70 c is a billion miles further out, in an orbit about the size of Neptune's.PDS 70 b was first revealed in 2018 in infrared light images from a planet-hunting instrument called SPHERE at the European Southern Observatory's Very Large Telescope (VLT). In June, astronomers used another VLT instrument called MUSE to observe a visible wavelength of light known as H-alpha, which is emitted when hydrogen falls onto a star or planet and becomes ionized.""H-alpha gives us more confidence that these are planets because it suggests they are still drawing in gas and dust and growing,"" Isella said.The millimeter wavelength observations from ALMA provide even more evidence.""It's complimentary to the optical data and provides completely independent confirmation that there is something there,"" he said.Isella said direct observation of planets with circumplanetary disks could allow astronomers to test theories of planet formation.""There's much that we don't understand about how planets form, and we now finally have the instruments to make direct observations and begin answering questions about how our solar system formed and how other planets might form.""Isella is an assistant professor of physics and astronomy and of Earth, environmental and planetary sciences at Rice and a co-investigator on the Rice-based, NASA-funded CLEVER Planets project.                                                                                                                        "
Patterns in DNA reveal hundreds of unknown protein pairings,https://phys.org/news/2019-07-patterns-dna-reveal-hundreds-unknown.html,https://3c1703fe8d.site.internapcdn.net/newman/csz/news/325u/2019/patternsindn.jpg,Biology,"July 11, 2019","Sequencing a genome is getting cheaper, but making sense of the resulting data remains hard. Researchers have now found a new way to extract useful information out of sequenced DNA.                                               By cataloging subtle evolutionary signatures shared between pairs of genes in bacteria, the team was able to discover hundreds of previously unknown protein interactions. This method is now being applied to the human genome, and could produce new insights into how human proteins interact.proteingenomeThe project is a collaboration between scientists at the University of Washington School of Medicine and Harvard University. Their report appears in the July 11 issue of Science.Science""Protein-protein interactions are fundamental to biological function. It's remarkable that they can now be predicted en masse using the large amounts of genomic sequence data that have been generated in recent years,"" said senior author David Baker, professor of biochemistry at the University of Washington School of Medicine.Cells are packed with proteins, many of which must physically interact in order to function. This can mean coming together to copy DNA or to form long fibers like those found in muscle. In many cases, however, scientists still do not know which proteins interact. Discovering new pairings can be slow, laborious, and costly.Looking for a better way, a team of four computational biologists studied a phenomenon called co-evolution, wherein changes in one gene are associated with changes in another. This can indicate that two genes are linked in some important way.For example, if one gene mutates to produce a protein with an altered shape, a second may evolve to produce a protein with a shape complementary to the first, thereby preserving the ability of the two proteins to interact.In recent years, researchers have found evidence for some of these subtle molecular interactions in an organism's DNA.""Co-evolution has been useful for understanding how specific proteins interact, but we can now use it as a tool for discovery,"" said lead author Qian Cong, a postdoctoral fellow at the UW School of Medicine.The research team compared more than 4,000 genes from E. coli to DNA sequences from more than 40,000 other bacterial genomes. This large stockpile of genetic information allowed the researchers to use a bespoke statistical model to assess co-evolution between each E. coli gene.After several rounds of analysis, 1,618 pairs were found to have the strongest evidence of co-evolution. By comparing their results to a small set of already characterized protein-protein interactions, the researchers achieved considerably higher accuracy than previous experimental screening methods.protein-protein interactionsAmong the newly discovered interactions were a few that hint at new biological insights. One of these, an interaction between a protein toxin and its antitoxin, may help explain, the researchers speculate, why some E. coli dominate their microbial niche. Another newfound pairing suggests that a protein called PstB, which was known to play a role in metabolism, may also help coordinate protein synthesis and mineral transport.""It is rare in biology for a software tool to make predictions that are promising enough to test, but that is exactly what's happening here,"" said Cong. There are literally hundreds of follow-up experiments that could be performed in labs around the world.""software toolThe team also scoured the genome of Mycobacterium tuberculosis, a disease bacterium distantly related to E. coli. They identified 911 protein-protein interactions with high confidence. 95 percent of these had never been previously described. Seventy involve proteins that may contribute to the virulence of M. tuberculosis, the researchers report. These findings may open new routes to develop drugs against the deadly pathogen.""We are going to apply this tool to more pathogens, and the human genome,"" says Cong. ""Our success will depend on how much work other scientists put into annotating which parts of the genome are genes and which parts are something else.""                                                                                                                        human genomegenes"
Alternating currents cause Jupiter's aurora,https://phys.org/news/2019-07-alternating-currents-jupiter-aurora.html,https://3c1703fe8d.site.internapcdn.net/newman/csz/news/325u/2019/jupiter.jpg,Astronomy & Space,"July 11, 2019","An international team of researchers has succeeded in measuring the current system responsible for Jupiter's aurora. Using data transmitted to Earth by NASA's Juno spacecraft, they showed that the direct currents were much weaker than expected and that alternating currents must therefore play a special role. On Earth, on the other hand, a direct current system creates its aurora. Jupiter's electric current system is kept going in particular by large centrifugal forces, which hurl ionized sulfur dioxide gas from the gas giant's moon Io through the magnetosphere.                                               Professor Dr. Joachim Saur from the Institute of Geophysics and Meteorology at the University of Cologne was involved in the project. The article ""Birkeland currents in Jupiter's magnetosphere observed by the polar-orbiting Juno spacecraft"" is published in the current issue of Nature Astronomy.magnetospherecurrentNature AstronomyJupiter, the largest planet in the solar system, has the brightest aurora, with a radiant power of 100 terawatts (100,000,000,000 kilowatts = one hundred billion KW). 100,000 power plants would be needed to produce this light. Similarly to the ones on Earth, Jupiter's aurora display themselves as two huge oval rings around the poles. They are driven by a gigantic system of electrical currents that connects the polar light region with Jupiter's magnetosphere. The magnetosphere is the region around a planet that is influenced by its magnetic field. Most of the electric currents run along Jupiter's magnetic field lines, also known as Birkeland currents.auroraelectric currentsNASA's Juno spacecraft has been in a polar orbit around Jupiter since July 2016. Its goal is to better understand the interior and aurora of Jupiter. Juno has now measured for the first time the electric direct current system responsible for Jupiter's aurora. For this purpose, the scientists measured the magnetic field environment of Jupiter with high precision in order to derive the electric currents. The total current is approximately 50 million amperes. However, this value is clearly below the theoretically expected values. The reason for this deviation are small-scale, turbulent alternating currents (also referred to as Alfvenic currents), which have so far received little attention. ""These observations, combined with other Juno spacecraft measurements, show that alternating currents play a much greater role in generating Jupiter's aurora than the direct current system,"" Joachim Saur said. He has been doing research on these turbulent alternating currents for 15 years, stressing their importance. Jupiter's aurora differ from those on Earth, which are essentially generated by direct currents. The Earth's northern lights shine about a thousand times weaker because the Earth is smaller than Jupiter, has a weaker magnetic field and rotates more slowly.""Jupiter's electric current systems are driven by the enormous centrifugal forces in Jupiter's rapidly rotating magnetosphere,"" Saur remarked. The volcanically active Jupiter moon Io produces one ton of sulfur dioxide gas per second, which ionizes into Jupiter's magnetosphere. ""Because of Jupiter's fast rotation—a day on Jupiter lasts only ten hours—the centrifugal forces move the ionized gas in Jupiter's magnetic field, which generate the electric currents,"" the geophysicist concludes.                                                                                                                        sulfur dioxide gasmagnetic field"
