title,url,image,category,date,content
Preterm babies are less likely to form romantic relationships in adulthood,https://medicalxpress.com/news/2019-07-preterm-babies-romantic-relationships-adulthood.html,https://3c1703fe8d.site.internapcdn.net/newman/csz/news/325u/2019/romanticrela.jpg,Pediatrics,"July 12, 2019","Adults who were born pre-term (under 37 weeks gestation) are less likely to have a romantic relationship, a sexual partner and experience parenthood than those born full term. The meta-analysis by researchers at the University of Warwick with data from up to 4.4 million adult participants showed that those born preterm are 28% less likely to ever be in a romantic relationship.                                           A meta-analysis conducted by researchers from the Department of Psychology at the University of Warwick has published 'Association of Preterm Birth/Low Birth Weight with Romantic Partnership, Sexual Intercourse and Parenthood in Adulthood: A Systematic Review and Meta-Analysis' in JAMA Network Open today, 12th of July. They have found that adults who were born pre-term are less likely to form romantic relationships than full-term peers.JAMA Network Openadultsromantic relationshipsIn the analysis 4.4 million adult participants those born preterm were 28% less likely to form romantic relationships and 22% less likely to become parents, when compared to those born full term.Those studies that looked at sexual relations of pre-term children found that they were 2.3 times less likely to ever have a sexual partner when compared to full terms.sexual relationssexual partnerThose adults who were born very (<32 weeks gestation) or extremely preterm <28 weeks gestation) had even lower chances of experiencing sexual relationships, finding a romantic partner or having children at the same age as those born full term, with the extremely pre-term born adults being 3.2 times less likely to ever having sexual relations.Close and intimate relationships have been shown to increase happiness and well-being both physically and mentally. However, studies also show that forming those relationships is harder for pre-term born adults, as they are usually timid, socially withdrawn and low in risk-taking and fun seeking.Despite having fewer close relationships, this meta-analysis also revealed that when preterm born adults had friends or a partner, the quality of these relationships was at least as good in preterms compared to full term born adults.meta-analysisFirst author of the paper, Dr. Marina Goulart de Mendonça from the Department of Psychology at the University of Warwick comments:""The finding that adults who were born pre-term are less likely to have a partner, to have sex and become parents does not appear to be explained by a higher rate of disability. Rather preterm born children have been previously found to have poorer social interactions in childhood that make it harder for them to master social transitions such as finding a partner, which in turn is proven to boost your wellbeing.""The senior author, Professor Dieter Wolke, from the Department of Psychology at the University of Warwick adds:""Those caring for preterm children including parent's health professionals and teachers should be more aware of the important role of social development and social integration for pre-term children. As preterm children tend to be more timid and shy, supporting them making friends and be integrated in their peer group will help them to find romantic partners, have sexual relationships and to become parents. All of which enhances wellbeing.""                                                                                                                        "
Creating two-dimensional layered Zintl phase by dimensional manipulation of the crystal structure,https://phys.org/news/2019-07-two-dimensional-layered-zintl-phase-dimensional.html,https://3c1703fe8d.site.internapcdn.net/newman/csz/news/325u/2019/creatingtwod.jpg,Physics,"July 12, 2019","The discovery of new families of two-dimensional (2-D) layered materials beyond graphene has always attracted great attention, but it remains challenging to artificially recreate the honeycomb atomic lattice structure with multi-components such as hexagonal boron nitride in the lab. In a new study now published on Science Advances, Junseong Song and colleagues at the departments of Energy Science, Nanostructure Physics, Environmental Science and Materials Science in the Republic of Korea developed an unprecedented structure of the Zintl phase.                                               Science AdvancesThey constructed the material by staking sp2-hybridized honeycomb ZnSb layers and via the dimensional manipulation of a crystal structure from the sp3-hybridized 3-D-ZnSb state. The materials scientists combined structural analysis with theoretical calculations to form a stable and robust layered structure of 2-D-ZnSb. This phenomenon of bi-dimensional polymorphism was not previously observed at ambient pressure in Zintl families. Therefore, the new work provides a rational design strategy to search and create new 2-D layered materials in various compounds. The new results will allow the unlimited expansion of 2-D libraries and their corresponding physical properties.  sp2-hybridizedsp3-hybridizedmaterials scientistsstructural analysisThe advent of Dirac physics of graphene triggered an explosive interest in research on two-dimensional (2-D) materials with varied applications in electronics, magnetics, energy and chemistry to quantum physics. At present, 2-D research is primarily focused on a few 2-D materials containing a single or several atomic layers exfoliated from their mother compounds, in contrast to 2-D atomic crystals such as silicone. This can restrict the method of 2-D materials development to two approaches of exfoliation and chemical vapor deposition. It is therefore highly desirable to expand on 2-D materials research to artificially create a new 2-D material with a new synthetic approach and form a variety of material groups. electronicsmagneticsenergyquantum physicsfew 2-D materialsseveral atomic layers2-D atomic crystals such as siliconeexfoliationchemical vapor depositionIn new materials discovery, transformation of a crystal structure is a widely recognized key factor. Where the temperature-pressure and electrostatic-doping induced structural phase transitions are core to explore a new crystal structure or to switch 2-D materials properties. For instance, most transition metal dichalcogenides exhibit polymorphic phase transition to access inherently diverse properties including superconducting and topological states. The transition has led to promising applications including electronic homojunction, photonic memory devices and catalytic energy materials. explore a new crystal structureswitch 2-D materialsmetal dichalcogenideselectronic homojunctioncatalytic energy materialsThese polymorphic transitions only occurred between different layered structures in the same two dimensions and remain to be realized between different dimensions of a crystal structure at ambient pressure. To reach ultimate crystal engineering and alter the structural dimension of multicomponent compounds is a promising next frontier in materials science beyond the allotropes of carbon. materials scienceallotropes of carbonIn the present work, Song et al. established bidimensional polymorphism via the discovery of 2-D layered structures in Zintl phases containing a large number of chemical compositions. Due to the sp2 hybrid orbital bonding of honeycomb-structured 2-D atomic crystals such as graphene and hexagonal boron nitride, the scientists expected the 3-D structured Zintl phases (with sp3 hybrid orbital bonding) to transform to sp2 honeycomb structured 2-D layered materials, as well, via electron transfer. As a proof-of-concept, Song et al. selected a 3-D orthorhombic ZnSb (3-D-ZnSb) Zintl phase and created the unprecedented, 2-D layered structure of ZnSb (2-D-ZnSb).bidimensional polymorphismcontaining a large number of chemical compositionsorthorhombicIn the new method, Song et al. first synthesized layered AZnSb (2-D-AZnSb) ternary compounds; where A referred to an alkali metal such as Na, Li and K. The materials contained a layered structure of ZnSb by transforming 3-D-ZnSb via A alloying, although the phases could be independently synthesized. Song et al. performed selective etching of A ions to create the 2-D-ZnSb in two different processes, including (1) chemical reaction in deionized water-incorporated solutions, and (2) electrochemical ion etching reaction in alkali-based electrolyte. ternary compoundsindependently synthesizedFor example, they synthesized the polycrystalline and single crystalline 2-D-LiZnSb intermediate substrate by first alloying Li into polycrystalline 3-D-ZnSb, followed by Li ion etching to form a 2-D-ZnSb crystal. The scientists easily cleaned the Li-etched 2-D-ZnSb crystals using adhesive tape exfoliation as mechanical cleaving to exhibit a typical flat surface as reported for 2-D materials.a typical flat surface as reported for 2-D materialsTo understand the effect of the manufacturing process, they examined the role of Li alloying and etching on structural transformations using X-ray photoelectron spectroscopy (XPS) measurements to reveal the difference between the 2-D and 3-D crystals. To further validate their findings, Song et al. used X-ray diffraction spectroscopy (XRD) patterns, transmission electron microscopy (TEM) observations and scanning tunneling electron microscopy (STEM) combined with energy-dispersive spectroscopy (EDS) elemental mapping to confirm the atomic structure of 2-D-ZnSb.scanning tunneling electron microscopyenergy-dispersive spectroscopyBased on the results, the scientists interpreted the stretchable interlayer distances between both Zn-Zn and Sb-Sb atoms as weak interlayer bonds and verified that the 2-D-ZnSb could be exfoliated as a layered material. The newly evolved layered structure of 2-D-ZnSb in the present work, completed the first discovery of bidimensional polymorphism in Zintl phases at ambient pressure. Accordingly, Song et al. manipulated the sp3-hybridized bonding state in 3-D-ZnSb into the sp2 state in 2-D-ZnSb honeycomb lattice. Previous studies on polymorphic transitions between 3-D and 2-D structures in Zintl phases were only observed under high pressure. The present results on bidimensional polymorphism between 3-D-ZnSb and 2-D-ZnSb emphasized the potential and broad availability of such an electron transfer to transform the crystal structure.  observed under high pressureSong et al. next investigated electrical transport properties of bidimensional ZnSb polymorphs and 2-D-LiZnSb crystals alongside first principles calculations of their electronic energy band structure. In contrast to the semiconducting nature of 3-D-ZnSb, both 2-D-LiZnSb and 2-D-ZnSb showed metallic conduction behavior. When they decreased the temperature, the electrical mobilities of both 2-D-LiZnSb and 2-D-ZnSb increased to a value higher than that of 3-D-ZnSb. The scientists credited the observed enlarged bandwidths for 2-D-ZnSb to the enhanced sp2 nature of honeycomb-structured layers with weakened interlayer interactions that formed the semi-metal. They used theoretical calculations to confirm that 2-D-ZnSb could be mechanically exfoliated into the bilayer to exist in an energetically stable form as a 2-D material, while the monolayer of 2-D-ZnSb was energetically unfavorable.structureTo demonstrate structural transformation of bidimensional ZnSb polymorphs during 2-D-LiZnSb formation, the scientists conducted synchrotron XRD - during the electrochemical reaction. They observed peaks corresponding to Li alloying of 3-D-ZnSb at pure 2-D-LiZnSb formation, followed by the final product of 2-D-ZnSb. During the electrochemical reaction, the Li atoms selectively penetrated into 3-D-ZnSb to break the Zn-Sb and Sb-Sb bonds. At the level of electron transfer, the hybridized bonding state changed from sp3 in 3-D-ZnSb to sp2 in 2-D-LiZnSb to form the puckered honeycomb lattice.      synchrotron XRDThe outcome of Li alloying based 2-D-LiZnSb transformation yielded the 2-D-ZnSb product, which did not return to its 3-D form. Song et al. showed that once formed, the layered 2-D-ZnSb was a stable material with a honeycomb architecture, validating the stable bidimensional polymorphic transition. The scientists anticipate applications of the new material in sustainable alkali ion batteries. In this way, Junseong Song and co-workers performed rigorous experimental and theoretical studies to demonstrate the creation of 2-D layered Zintl phases by manipulating the structural dimensionality. The new method is a first to establish the bidimensional polymorphic family in Zintl phases at ambient pressure, to allow new phase transformations as a general route of synthesis. This work provides a rational design strategy to explore new 2-D layered materials and unlock further properties of interest within materials, such as 2-D magnetism, ferroelectricity, thermoelectricity and topological states for further applications.                                                                                                                        materials                                                © 2019 Science X Network                                            "
Identifying perceived emotions from people's walking style,https://techxplore.com/news/2019-07-emotions-people-style.html,https://3c1703fe8d.site.internapcdn.net/newman/csz/news/325u/2019/identifyingp.jpg,Machine Learning & AI,"July 12, 2019","A team of researchers at the University of North Carolina at Chapel Hill and the University of Maryland at College Park has recently developed a new deep learning model that can identify people's emotions based on their walking styles. Their approach, outlined in a paper pre-published on arXiv, works by extracting an individual's gait from an RGB video of him/her walking, then analyzing it and classifying it as one of four emotions: happy, sad, angry or neutral.                                              pre-published on arXiv""Emotions play a significant role in our lives, defining our experiences, and shaping how we view the world and interact with other humans,"" Tanmay Randhavane, one of the primary researchers and a graduate student at UNC, told TechXplore. ""Perceiving the emotions of other people helps us understand their behavior and decide our actions toward them. For example, people communicate very differently with someone they perceive to be angry and hostile than they do with someone they perceive to be calm and contented.""Most existing emotion recognition and identification tools work by analyzing facial expressions or voice recordings. However, past studies suggest that body language (e.g., posture, movements, etc.) can also say a lot about how someone is feeling. Inspired by these observations, the researchers set out to develop a tool that can automatically identify the perceived emotion of individuals based on their walking style. emotion recognition""The main advantage of our perceived emotion recognition approach is that it combines two different techniques,"" Randhavane said. ""In addition to using deep learning, our approach also leverages the findings of psychological studies. A combination of both these techniques gives us an advantage over the other methods.""deep learningThe approach first extracts a person's walking gait from an RGB video of them walking, representing it as a series of 3-D poses. Subsequently, the researchers used a long short-term memory (LSTM) recurrent neural network and a random forest (RF) classifier to analyze these poses and identify the most prominent emotion felt by the person in the video, choosing between happiness, sadness, anger or neutral. The LSTM is initially trained on a series of deep features, but these are later combined with affective features computed from the gaits using posture and movement cues. All of these features are ultimately classified using the RF classifier. Randhavane and his colleagues carried out a series of preliminary tests on a dataset containing videos of people walking and found that their model could identify the perceived emotions of individuals with 80 percent accuracy. In addition, their approach led to an improvement of approximately 14 percent over other perceived emotion recognition methods that focus on people's walking style. ""Though we do not make any claims about the actual emotions a person is experiencing, our approach can provide an estimate of the perceived emotion of that walking style,"" Aniket Bera, a Research Professor in the Computer Science department, supervising the research, told TechXplore. ""There are many applications for this research, ranging from better human perception for robots and autonomous vehicles to improved surveillance to creating more engaging experiences in augmented and virtual reality.""Along with Tanmay Randhavane and Aniket Bera, the research team behind this study includes Dinesh Manocha and Uttaran Bhattacharya at the University of Maryland at College Park, as well as Kurt Gray and Kyra Kapsaskis from the psychology department of the University of North Carolina at Chapel Hill.  To train their deep learning model, the researchers have also compiled a new dataset called Emotion Walk (EWalk), which contains videos of individuals walking in both indoor and outdoor settings labeled with perceived emotions. In the future, this dataset could be used by other teams to develop and train new emotion recognition tools designed to analyze movement, posture, and/or gait.  ""Our research is at a very primitive stage,"" Bera said. ""We want to explore different aspects of the body language and look at more cues such as facial expressions, speech, vocal patterns, etc., and use a multi-modal approach to combine all these cues with gaits. Currently, we assume that the walking motion is natural and does not involve any accessories (e.g., suitcase, mobile phones, etc.). As part of future work, we would like to collect more data and train our deep-learning model better. We will also attempt to extend our methodology to consider more activities such as running, gesturing, etc."" According to Bera, perceived emotion recognition tools could soon help to develop robots with more advanced navigation, planning, and interaction skills. In addition, models such as theirs could be used to detect anomalous behaviors or walking patterns from videos or CCTV footage, for instance identifying individuals who are at risk of suicide and alerting authorities or healthcare providers. Their model could also be applied in the VFX and animation industry, where it could assist designers and animators in creating virtual characters that effectively express particular emotions.                                                                                                                                                                        © 2019 Science X Network                                            "
Strange warping geometry helps to push scientific boundaries,https://phys.org/news/2019-07-strange-warping-geometry-scientific-boundaries.html,https://3c1703fe8d.site.internapcdn.net/newman/csz/news/325u/2019/strangewarpi.jpg,Physics,"July 12, 2019","Atomic interactions in everyday solids and liquids are so complex that some of these materials' properties continue to elude physicists' understanding. Solving the problems mathematically is beyond the capabilities of modern computers, so scientists at Princeton University have turned to an unusual branch of geometry instead.                                               Researchers led by Andrew Houck, a professor of electrical engineering, have built an electronic array on a microchip that simulates particle interactions in a hyperbolic plane, a geometric surface in which space curves away from itself at every point. A hyperbolic plane is difficult to envision—the artist M.C. Escher used hyperbolic geometry in many of his mind-bending pieces—but is perfect for answering questions about particle interactions and other challenging mathematical questions.particle interactionshyperbolic geometryThe research team used superconducting circuits to create a lattice that functions as a hyperbolic space. When the researchers introduce photons into the lattice, they can answer a wide range of difficult questions by observing the photons' interactions in simulated hyperbolic space.""You can throw particles together, turn on a very controlled amount of interaction between them, and see the complexity emerge,"" said Houck, who was the senior author of the paper published July 4 in the journal Nature.NatureAlicia Kollár, a postdoctoral research associate at the Princeton Center for Complex Materials and the study's lead author, said the goal is to allow researchers to address complex questions about quantum interactions, which govern the behavior of atomic and subatomic particles.""The problem is that if you want to study a very complicated quantum mechanical material, then that computer modeling is very difficult. We're trying to implement a model at the hardware level so that nature does the hard part of the computation for you,"" said Kollár.The centimeter-sized chip is etched with a circuit of superconducting resonators that provide paths for microwave photons to move and interact. The resonators on the chip are arranged in a lattice pattern of heptagons, or seven-sided polygons. The structure exists on a flat plane, but simulates the unusual geometry of a hyperbolic plane.""In normal 3-D space, a hyperbolic surface doesn't exist,"" said Houck. ""This material allows us to start to think about mixing quantum mechanics and curved space in a lab setting.""Trying to force a three-dimensional sphere onto a two-dimensional plane reveals that space on a spherical plane is smaller than on a flat plane. This is why the shapes of countries appear stretched out when drawn on a flat map of the spherical Earth. In contrast, a hyperbolic plane would need to be compressed in order to fit onto a flat plane.""It's a space that you can mathematically write down, but it's very difficult to visualize because it's too big to fit in our space,"" explained Kollár.To simulate the effect of compressing hyperbolic space onto a flat surface, the researchers used a special type of resonator called a coplanar waveguide resonator. When microwave photons pass through this resonator, they behave in the same way whether their path is straight or meandering. The meandering structure of the resonators offers flexibility to ""squish and scrunch"" the sides of the heptagons to create a flat tiling pattern, said Kollár.Looking at the chip's central heptagon is akin to looking through a fisheye camera lens, in which objects at the edge of the field of view appear smaller than in the center—the heptagons look smaller the farther they are from the center. This arrangement allows microwave photons that move through the resonator circuit to behave like particles in a hyperbolic space.The chip's ability to simulate curved space could enable new investigations in quantum mechanics, including properties of energy and matter in the warped space-time around black holes. The material could also be useful for understanding complex webs of relationships in mathematical graph theory and communication networks. Kollár noted that this research could eventually aid the design of new materials.quantum mechanicsspaceBut first, Kollár and her colleagues will need to further develop the photonic material, both by continuing to examine its mathematical basis and by introducing elements that enable photons in the circuit to interact.""By themselves, microwave photons don't interact with each other—they pass right through,"" said Kollár. Most applications of the material would require ""doing something to make it so that they can tell there's another photon there.""                                                                                                                        "
