title,url,image,category,date,content
Researchers write ABCs of language disorder,https://medicalxpress.com/news/2019-07-abcs-language-disorder.html,https://3c1703fe8d.site.internapcdn.net/newman/csz/news/325u/2019/11-researchersw.jpg,Pediatrics,"July 12, 2019","While we expect to see scientists publishing in journals aimed at peers, a pair of Western researchers recently targeted a younger audience for their work—a lot younger.                                                Reviewers for their newest scholarly paper, ""Developmental Language Disorder: The Childhood Condition We Need to Talk About,"" are ages 8, 10 and 13. When not reviewing science papers for Frontiers for Young Minds, young Amelie feeds elderly elephants in Thailand, while co-reviewers Ari and Elliot describe themselves as ""book hounds and lifelong neighbours.""science papersFrontiers for Young MindsFrontiers for Young Minds is an open-access science journal written for kids, reviewed and edited by kids. Recent articles included an exploration of star formation, innovations in brain-computer interface and parenting in invertebrate animals.""Writing for Frontiers has been incredible,"" said Western graduate student Alyssa Kuiack, lead author of the paper, which she chose as part of her final project in Communication Sciences and Disorders professor Lisa Archibald's Speech Language Pathology class.""We researchers get so caught up in our own jargon, our own terminology. It's good to hear someone say, ""This doesn't make sense. This is above our vocabulary or understanding.""""Papers for the publication are all written by academic researchers and follow scientific method, including abstract, conflict-of-interest statement, references and citations.""It's just a bit more reader-friendly, more accessible than traditional science journals,"" said Kuiack, a masters/Ph.D. student in Clinical Sciences in Speech Language Pathology/Speech Science.People with developmental language disorder (DLD) struggle to learn and understand oral and written communication, despite their normal or above-normal intelligence. Their vocabulary and grammar fall below their classmates—with the result that they have difficulty grasping new material if it's taught in conventional ways, or showing in written form what they've learned.developmental language disorderDLD is a relatively recent term, having been endorsed in 2017 by a panel of experts out of concern that a wide range of alternate terminologies was hampering diagnosis and treatment.That's one reason Kuiack and Archibald wanted to reach younger readers.""DLD is very common. If your class was made up of 28 students, there would be about two students in your class with DLD,"" the article explains.The article identifies what the disorder is, who has it and how children, their families and teachers can work through it.""It's so important to give kids this information because kids really aren't hearing it in their classrooms, even though they almost certainly have classmates with DLD,"" Kuiack said.Added Archibald, ""Equipping kids about their disorder is an important piece. Kids really need to be self-advocates, especially as they get older.""Writing science for younger readers also helps researchers hone their thoughts and communicate research clearly for a broader range of audiences, Archibald said. ""It offers our students important practise in different kinds of writing.""Kuiack said the review process was similar to that of other journals, with questions and suggestions shared among reviewers and authors through a message board. She found the process all positive and said it's encouraging to be part of a journal that inspires a new generation of scientists.                                                                                                                        review process"
What delayed Earth's oxygenation?,https://phys.org/news/2019-07-earth-oxygenation.html,https://3c1703fe8d.site.internapcdn.net/newman/csz/news/325u/2019/1-whatdelayede.jpg,Earth,"July 12, 2019","Powering a massive biosphere on Earth, photosynthesis is the light-mediated reaction that converts carbon dioxide and water to carbohydrates and oxygen. About 2.3 billion years ago, this reaction led to a dramatic oxygenation of Earth's atmosphere.                                               Evidence exists for oxygen-releasing photosynthesis evolving much earlier—perhaps as early as 3 billion years ago. However, the oxygen-rich atmosphere we take for granted today has existed for only about 10 percent of Earth's 4.5-billion-year history. Why did oxygenation of the atmosphere occur so much later than the evolution of oxygen-releasing photosynthesis?oxygen-rich atmosphereatmosphere""The striking lag has remained an enduring puzzle in the fields of Earth history and planetary science,"" says Christopher Reinhard, an assistant professor in the School of Earth and Atmospheric Sciences (EAS).planetary scienceReinhard, former EAS postdoctoral researcher Kazumi Ozaki, and collaborators have proposed a solution to the puzzle. Their findings, published in Nature Communications, suggest that in the oceans of early Earth, oxygen-releasing photosynthesizers could not compete effectively with their primitive counterparts.Nature CommunicationsModern photosynthesizers consume water and release oxygen. Primitive ones instead consume dissolved iron ions—which would have been abundant in the oceans of early Earth. They produce rust as a byproduct instead of oxygen.Using experimental microbiology, genomics, and large-scale biogeochemical modeling, ""we found that photosynthetic bacteria that use iron instead of water are fierce competitors for light and nutrients,"" says Ozaki, the paper's first author and now an assistant professor in the Department of Environmental Science at Toho University, in Japan. ""We propose that their ability to outcompete oxygen-producing photosynthesizers is an important component of Earth's global oxygen cycle.""photosynthetic bacteriaThe study is part of Reinhard's research goal to understand how the evolution of the photosynthetic biosphere controlled the composition of Earth's atmosphere. ""We want to understand the timing of major biological innovations and their impact on the chemistry of Earth's oceans and atmosphere. We consider these principles to be central in understanding our own evolutionary origins and the search for life beyond our solar system.""""Our results contribute to a deeper knowledge of the biological factors controlling the long-term evolution of Earth's atmosphere,"" Ozaki says. ""They offer a better mechanistic understanding of the factors that promote oxygenation of the atmospheres of Earth-like planets beyond our solar system."" The results ""yield an entirely new vantage from which to build theoretical models of Earth's biogeochemical oxygen cycle,"" Reinhard adds.                                                                                                                        "
"Study deciphers packaging of tumor 'cargo,' leading to better understanding of how cancers spread",https://medicalxpress.com/news/2019-07-deciphers-packaging-tumor-cargo-cancers.html,https://3c1703fe8d.site.internapcdn.net/newman/csz/news/325u/2019/studydeciphe.jpg,Oncology & Cancer,"July 12, 2019","Researchers at the University of Notre Dame have outlined the delivery mechanism tumor cells use to move nucleic acids into small sacs shed from their surfaces—information that is eventually shared with other cells within the tumor microenvironment, causing the cancer to spread.                                                The study, published in Nature Cell Biology, demonstrates how microRNA ""cargo"" is moved into the sacs, called extracellular vesicles, in a process similar to how a package would be delivered through a series of trucks, cars and postal workers. The released vesicles taken up by other non-tumor cells change the behavior of surrounding recipient cells.Nature Cell Biologyextracellular vesiclesIn addition to demonstrating the pathway in which biological information is processed, the study also shows that the microRNAs are transferred to other cells within the tumor's microenvironment.""We have wanted to better understand how the biological information gets assembled into the vesicles,"" said Crislyn D'Souza-Schorey, the Morris Pollard Professor and chair of the Department of Biological Sciences and a faculty member of Notre Dame's Harper Cancer Research Institute and the Advanced Diagnostics and Therapeutics initiative. ""Once released from the tumor cell, these vesicles serve as 'information packets' with instructions for other cells in the tumor microenvironment. Deciphering this new dimension of communication between cells allows us to better understand how cancers spread.""tumor microenvironmentcellsD""Souza-Schorey and collaborators show how, when first moved outside the nucleus of the tumor cell, a precursor to a mature microRNA binds to specific cellular proteins. This facilitates its delivery to other proteins that ultimately shuttle the microRNA to the vesicles forming at the cell surface.Once shed from the tumor cells, these vesicles can be found circulating through the body in fluids like blood and urine. As such, they can be used as ""biomarkers"" that can point to the presence of cancer. If perfected, the process of detecting these vesicles, through a liquid biopsy, can lead to early detection of different types of tumors.tumor cellsAdditionally, because the shed tumor vesicles carry specific disease-related molecules, researchers can also start devising potential new cancer therapies. ""Now that we understand a little more about how these molecules are trafficked and assembled into tumor vesicles, scientists can manipulate these steps to rework the content of these vesicles,"" D'Souza-Schorey said. ""It's like altering and correcting the message released from the tumor cell.""                                                                                                                        tumor"
Ploonets: Exiled moons may explain astronomical mysteries,https://phys.org/news/2019-07-ploonets-exiled-moons-astronomical-mysteries.html,https://3c1703fe8d.site.internapcdn.net/newman/csz/news/325u/2019/ploonetsexil.jpg,Astronomy & Space,"July 12, 2019","Moons ejected from orbits around gas giant exoplanets could explain several astronomical mysteries, an international team of astronomers suggests.                                               Researchers led by Mario Sucerquia, from the Universidad de Antioquia, Colombia, and Jaime Alvarado-Montes from Australia's Macquarie University, modelled the likely behaviour of giant exomoons predicted to form around massive planets—and discovered that they would be expelled and sent packing.massive planetsRoughly 50 percent of these ejected moons would survive both the immediate expulsion and avoid any subsequent collision with the planet or the star, ending up as quasi-planets travelling around the host star, but in eccentric ""Pluto-like"" orbits.host starThese rogue moons—dubbed ""ploonets"" by Sucerquia, Alvarado-Montes and colleagues—could potentially explain several puzzling phenomena, not the least of which is why astronomers have so far confirmed the existence of at least 4098 exoplanets, but not a single exomoon.Most of the planets discovered thus far are of a type known as Hot Jupiters, a fact that reflects mainly the limits of current detection technology. Previous research indicates that at least some of these should be orbited by large moons.Their absence, the researchers write in a paper soon to be published in the journal Monthly Notices of the Royal Astronomical Society, could be explained by a scenario in which the angular momentum between the two bodies results in the moon escaping the gravitational pull of its parent.Monthly Notices of the Royal Astronomical Societyangular momentummoon""These moons would become planetary embryos, or even fully-fledged planets, with highly eccentric orbits of their own,"" explains Alvarado-Montes.planetsWhile conceding that ploonets remain hypothetical, the researchers say their existence would offer a possible explanation for several challenging results produced by NASA's now-retired Kepler space telescope.possible explanationThese include the puzzling dips in the light-curves emanating from a formally known as KIC-8462852.""It's better known as Tabby Star,"" says Alvarado-Montes, ""and the strange changes in its light intensity have been observed for years, but are still not understood. Ploonets could be the answer.""They might also explain apparent evidence of cannibalism between some stars, or the existence of ""exocomets"" around others.starsPloonets, thus, may be a vital piece of the planetary puzzle, but, as yet, their existence remains unproven.Sucerquia, Alvarado-Montes and colleagues concede that even if they do exist, they may deteriorate too rapidly to ever be observed.""If, on the other hand,"" they write, ""the timescales are large enough, we could have real chances to detect them in the near and middle future.""The paper, ""Ploonets: formation, evolution, and detectability of tidally detached exomoons,"" is currently available on arXiv, the preprint library maintained by Cornell University in the US.                                                                                                                        "
Nanotechnology delivers hepatitis B vaccine,https://phys.org/news/2019-07-nanotechnology-hepatitis-vaccine.html,https://3c1703fe8d.site.internapcdn.net/newman/csz/news/325u/2019/5-vaccine.jpg,Nanotechnology,"July 12, 2019","Brazilian and European researchers have demonstrated exactly how a nanotechnology-based compound delivers an oral vaccine against hepatitis B to the immune system. When particles containing silica and an antigen combine, even though they are different sizes, they reach the intestine without being destroyed by the acidity of the digestive system.                                               A compound of nanostructured SBA-15 silica and HBsAg, the hepatitis B surface antigen, was submitted to different types of X-ray imaging in European laboratories.The nanostructured silica was developed by researchers at the University of São Paulo's Physics Institute (IF-USP) in Brazil. The antigen was created by the Butantan Institute, which is also in São Paulo. The results are published in Scientific Reports.Scientific ReportsThe aim of the study was to understand how a 22-nanometer-sized antigen binds to silica nanotubes with a diameter of approximately 10 nanometers and a honeycomb-like structure. One nanometer (1 nm) is a billionth of a meter. Studies carried out at USP revealed the measurements of both the antigen and the silica nanotubes using small-angle X-ray scattering (SAXS), dynamic light scattering (DLS), and transmission electron microscope.""Despite the size difference, tests [in animals] produced an excellent immune response to the oral vaccine—as good as the injectable form or better,"" said Márcia Fantini, full professor at IF-USP.oral vaccineX-ray and neutron imaging was coordinated by Heloisa Bordalo, a Brazilian researcher at the University of Copenhagen's Niels Bohr Institute in Denmark. In collaboration with other researchers in Denmark as well as colleagues in France, Germany, Sweden and Switzerland, Bordalo submitted the compound to small-angle X-ray scattering (SAXS), among other techniques.The three-dimensional images obtained by these techniques showed that although the antigen did not enter the nanotubes, it was retained in 50 nm macropores between the nanotubes. This protected it from the acidity of the digestive system.three-dimensional imagesThe images also enabled the researchers to determine the ideal proportion of silica and HBsAg so that the antigen did not agglomerate, hindering the dispersion of the active principle in the patient's intestine. ""The oral and intranasal routes are natural modes of vaccine administration. Nature is the best vaccination agent. However, a vaccine that contains a protein, as in this case, is destroyed by high acidity and its own proteases in passing through the stomach, so it doesn't reach the immune system, particularly the small intestine,"" said Osvaldo Augusto Sant""Anna, Scientific Leader at Butantan Institute and responsible for development of the HbsAg antigen.Before proceeding to clinical trials, the team will test polymers that can be used to coat the entire structure and increase the medication's resistance to the human stomach. In animal trials, the formulation proved to be as effective as the injected vaccine, if not more so, in delivering the antigen to the intestine, where the immune system can detect it and produce antibodies against the virus.clinical trialsimmune systemAccording to the World Health Organization (WHO), approximately 257 million people currently live with hepatitis B worldwide.PolyvaccinePolyvaccineThrough a project supported by FAPESP, the group led by Sant""Anna, Fantini and Bordalo is now developing new antigens to add to the compound. The idea is to have at least a triple vaccine by adding other antigens against diphtheria and tetanus.However, the formulation may evolve to become a polyvaccine that also immunizes people against whooping cough, poliomyelitis and Haemophilus influenzae type B (Hib), the bacterium that causes meningitis and pneumonia, among other diseases.The antigens must combat the diseases without interfering with each other. ""There have been very interesting results with diphtheria, and we're now going to test it for tetanus, initially in injectable form,"" Sant""Anna said.                                                                                                                        "
Red wine may hold the key to next-gen wearable technology,https://phys.org/news/2019-07-red-wine-key-next-gen-wearable.html,https://3c1703fe8d.site.internapcdn.net/newman/csz/news/325u/2019/redwine.jpg,Nanotechnology,"July 12, 2019","A team of scientists are seeking to kick-start a wearable technology revolution by creating flexible fibres and adding acids from red wine.                                               Extracting tannic acid from red wine, coffee or black tea, led a team of scientists from the University of Manchester to develop much more durable and flexible wearable devices. The addition of tannins improved mechanical properties of materials such as cotton to develop wearable sensors for rehabilitation monitoring, drastically increasing the devices lifespan.tannic acidblack teawearableThe team have developed wearable devices such as capacitive breath sensors and artificial hands for extreme conditions by improving the durability of flexible sensors. Previously, wearable technology has been subject to fail after repeated bending and folding which can interrupt the conductivity of such devices due to tiny micro cracks. Improving this could open the door to more long-lasting integrated technology.extreme conditionsDr. Xuqing Liu who led the research team said: ""We are using this method to develop new flexible, breathable, wearable devices. The main research objective of our group is to develop comfortable wearable devices for flexible human-machine interface.""Traditional conductive material suffers from weak bonding to the fibers which can result in low conductivity. When red wine, or coffee, or black tea, is sprinkled on dress, it will be difficult to get rid of these stains. The main reason is that they all contain tannic acid, which can firmly adsorb the material on the surface of the fiber. This good adhesion is exactly what we need for durable wearable, conductive devices.""The new research published in the journal Small demonstrated that without this layer of tannic acid, the conductivity is several hundred times, or even thousands of times, less than traditional conductive material samples as the conductive coating becomes easily detached from the textile surface through repeated bending and flexing.SmallThe team used commercially available tannins but also tried to immerse the fabric directly in red wine, black tea and black coffee solutions where they saw the same results. The overall impact of this new method could see a reduction in price for wearable technology along with improvements in comfort and robustness.red wineThe improved conductivity using natural sources can allow technology developers to use more comfortable fabrics, such as cotton, to replace nylon, which is stiff and uncomfortable. The technology can also allow for circuits to be printed directly on to the surface of clothing to make a comfortable, flexible circuit board.natural sourcestechnologyDue to the strong adsorption of tannic acid, the surface conductive coating has good durability, and the developed wearable devices maintain excellent performance after bending, folding and stretching.                                                                                                                        "
