title,url,image,category,date,content
NASA's Green Fuel Satellite Jumps Its First HurdleHailey Lynne McKeefry,https://www.eetimes.com/document.asp?doc_id=1334905,https://m.eet.com/media/1312663/Ball_Aerospace_commissions_small_satellite.jpg,Military & Aerospace Designline,07.10.19,"Like the auto industry, space flight is going green by looking for new and sustainable fuel sources. Today, it is eying fuel options that are safer to handle than the highly toxic fuel, hydrazine. Last week, Bell Aerospace officially commissioned NASA's Green Propellant Infusion Mission (GPIM) and begun on-orbit testing of a non-toxic, high-performance propellant. The mission launched on June 25, 2019 at 2:30 a.m. EDT on board a SpaceX Falcon Heavy rocket. ""This mission has been an excellent example of an industry-led team involving multiple NASA centers, the Air Force and industry partners to test this new high-performance fuel using a Ball small satellite,"" said Dr. Makenzie Lystrup, vice president and general manager, Civil Space, at Ball Aerospace.The new green propellant will be an enabling technology for commercial spaceports operating across the United States, according to NASA.The green propellant makes fuel loading safer, cheaper, and more efficient.  and much less costly. The mission hopes to shorten ground processing time from weeks to days, which in turn reduces costs, and to simplify building and operating satellites. “The space technology infusion mission also strives to optimize performance in new hardware, system and power solutions while ensuring the best value for investment and the safest space missions possible,” NASA claimed.Ball Aerospace designed and built the Ball Configurable Platform (BCP) small satellite, which contains NASA's first opportunity to demonstrate the practical capabilities of a ""green"" propellant and propulsion system in orbit. The GPIM project will demonstrate the practical capabilities of this Hydroxyl Ammonium Nitrate fuel/oxidizer blend, which reduces toxicity levels compared to hydrazine and is easier and safer to store and handle.  The alternative to conventional chemical propulsion systems is called AF-M315E and was developed by the Air Force Research Laboratory.  “AF-M315E is expected to improve overall vehicle performance,” NASA said. “It boasts a higher density than hydrazine, meaning more of it can be stored in containers of the same volume. In addition, it delivers a higher specific impulse, or thrust delivered per given quantity of fuel, and has a lower freezing point, requiring less spacecraft power to maintain its temperature.” GPIM is part of NASA's Technology Demonstration Missions program within the Space Technology Mission Directorate (STMD). Ball Aerospace’s Christopher McLean serves as the principal investigator for the program. Meanwhile, thrusters designed and built by Aerojet Rocketdyne provide propulsion for the spacecraft.""The successful commissioning of our thrusters and propulsion system is a positive step toward fully qualifying our green propulsion system in space,"" said Joe Cassady, executive director of space at Aerojet Rocketdyne. ""This technology will enable propulsive capabilities for a new generation of small satellites, including new mission capabilities.""The program will test the thruster capabilities by verifying the propulsion subsystem, propellant performance, thruster performance, and spacecraft attitude control performance over the first three months. Testing of secondary payloads will occur over the remaining time in the 13-month testing period. Ball Aerospace, as the prime contractor, is tasked with system engineering; flight thruster performance verification; ground and flight data review; spacecraft bus; assembly, integration and test; and launch and flight support.  At the end, the project will present the fuel, as well as compatible tanks, valves and thrusters, for use by NASA and for commercial spaceflight applications. The small satellite, which is about the size of a mini refrigerator, was built in just 46 days.  Currently, two other BCP small satellites are also on orbit: STPSat-2, which launched in November 2010, and STPSat-3, which launched in November 2013. The two STP satellites were built for the U.S. Air Force Space Test Program's Standard Interface Vehicle (STP-SIV) project, Ball said.— Hailey Lynne McKeefry, Editor in Chief,  EBN "
Eta's Ultra Low-Power Machine Learning Platform Maurizio Di Paolo Emilio,https://www.eetimes.com/document.asp?doc_id=1334903,https://m.eet.com/media/1312661/Etafig4.jpg,AI & Big Data Designline,07.10.19,"Eta Compute has developed a high-efficiency ASIC and new artificial intelligence (AI) software based on neural networks to solve the problems of edge and mobile devices without the use of cloud resources.Future mobile devices, which are constantly active in the IoT ecosystem, require a disruptive solution that offers processing power to enable machine intelligence with low power consumption for applications such as speech recognition and imaging.These are the types of applications for which Eta Compute designed its ECM3531.The IC is based on the ARM Cortex-M3 and NXP Coolflux DSP processors. It uses a tightly integrated DSP processor and a microcontroller architecture for a significant reduction in power for the intelligence of embedded machines. The SoC includes an analog to digital converter (ADC) sensor interface and highly efficient PMIC circuits. The chip also includes I2C, I2S, GPIOs, RTC, PWM, POR, BOD, SRAM and Flash. The patented hardware architecture (DIAL) is combined with fully customizable CNN-based algorithms to perform machine learning inference in hundreds of microwatts.The processor, named Tensai, can be used with the popular TensorFlow or Caffe Software. This solution can support a wide range of applications in audio, video and signal processing where power is a strict constraint, such as in UAV (unmanned aerial vehicles) markets, in the Internet of things (IoT) and wearable markets.ECM3531SP includes pretrained learning machine speech recognition and keyword spotting applications. ECM3531PG pretrained photoplethysmogram (PPG) application and ECM3531SF includes machine algorithms for fusion of gyro, magnometer, and accelerometer sensors (Figure 1).The patented hardware architecture is combined with the fully customizable Eta Compute algorithms based on CNN, LSTM, GRU and SNN (spiking neural network) to perform machine learning inference in very few mW. Eta provides kernel software for convolutional neural networks on Coolflux's DSP, which are scalable compared to other NN (neural networks) and which will reduce an additional 30% of the power with asynchronous technology.Tensai's computational properties offer 30-fold power reduction in a specific CNN-based image classification benchmark — unlike other Cortex-M7-class microcontrollers. Eta Compute has reached 0.04mJ per image out of 8 million operations (figure 2).The high energy efficiency ASIC and the CNN software developed by Eta Compute avoid the need for numerous training samples for peripheral applications, where the amount of resources (both memory and calculation) is limited. A recent benchmark reached by Eta Compute was an improvement of 2-3 orders of magnitude in the efficiency of the model compared to various variants of neural networks for keyword recognition by consuming only 2 mW of power.For sensing applications, particularly for motion and environmental sensors, the Eta Compute methodology allows sensor hubs to execute more extensive sensor algorithms by providing data and updates in real time from mobile network devices and the Internet of Things (IoT). The collaboration with Rohm Semiconductor has enabled the development of a Wireless Smart Ubiquitous Network (Wi-SUN) which is compatible with sensor nodes. The nodes will combine Rohm sensor technology and Eta Compute's low-power MCUs to offer solutions for intelligent utility and IoT networks for smart cities. They will be designed for frequent low-latency communications that absorb less than 1 μA during rest and, more importantly, only 1 mA during detection.Eta Compute believes that neural network technology will play a key role in enabling intelligent peripheral devices. Thanks to the ability to learn and process sensory data directly on the margins in an energy efficient manner, new ASICs will provide relief to the bandwidth requirements needed to send raw data to a cloud-based learning service. The energy efficiency of neuromorphic processors will also allow ""always on"" solutions without suffering from handicaps deriving from power requirements.Next page: Where Tensai fits into the AI marketNext page: Where Tensai fits into the AI market  "
Fab Tool Outlook Clouds Further Dylan McGrath,https://www.eetimes.com/document.asp?doc_id=1334906,https://m.eet.com/media/1312666/semi_west-2019_800_2-min.png,Memory Designline,07.10.19,"SAN FRANCISCO — The semiconductor industry’s temperature has gone from lukewarm to freezing as the year has evolved, with analysts who had once forecast modest growth now projecting that IC sales will contract by a double-digit percentage.This week, at Semicon West — the semiconductor equipment and materials industry’s annual tradeshow — the SEMI trade association delivered revised forecasts for the year that call for wafer fab equipment sales to decline by roughly 18% this year. SEMI now expects sales of semiconductor materials to decline slightly this year.RecommendedIntel Shows Next Steps in PackagingRecommendedIntel Shows Next Steps in Packaging“After three years of consecutive growth from 2016 through 2018, we are seeing a big correction in 2019,” said Clark Tseng, director of industry research and statistics at SEMI. “Actually, we saw this coming in the second half of 2018, but the correction seems to be bigger than we expected.”Indeed, after consecutive all-time record sales of $56.6 billion in 2017 and $64.5 billion in 2018, wafer fab equipment sales are now projected to fall to $52.7 billion in 2019. And while SEMI is forecasting that equipment sales will rebound to grow 11% next year, reaching $58.8 billion, whether that will actually happen is a matter of considerable debate.A number of factors that dragged down chip sales in the first half of the year are still at issue, including the near-freefall of memory chip prices from their lofty peak in early 2018, excess inventory at many suppliers, weaker-than-expected demand, and ongoing trade tension between the U.S. and China. Tseng said that he expects these headwinds to continue in the second half of the year and that slower-than-expected inventory digestion could result in chip inventories remaining out of whack through the end of 2019.“The demand has not fallen off, but the inventory issue was a lot more severe than people expected,” said Mario Morales, vice president of enabling technologies, storage, and semiconductor research at IDC.Amid oversupply, memory chip suppliers have slashed capital expenditures for the year by about 40% compared with 2018. Tseng said that he expects a recovery in capex for both DRAM and NAND flash to recover in 2020, beginning with NAND. He expects DRAM capex to recovery to roughly the level of 2017 next year and expects to see NAND capex increase by more than 50% compared to this year.But not all analysts are convinced that 2020 will see a recovery in capital equipment spending.“I’m looking for an equipment recovery starting in the Q3 2020 time frame and not before that,” said CJ Muse, a managing director and senior equity research analyst at investment banking firm Evercore ISI, during the annual Semicon West “Bulls and Bears” panel."
Memory Startup Targets High-Performance ComputingNitin Dahad,https://www.eetimes.com/document.asp?doc_id=1334908,https://m.eet.com/media/1312673/ComputerrunningBlueshiftFPGAcard.jpg,Memory Designline,07.10.19,"A Cambridge UK-based startup is looking to address the memory bottleneck (or tailback) in high-performance computing with a new memory chip design dedicated to handling large data sets and time-critical data.Blueshift Memory, which was started by and currently consists of a team of three computer scientists, has successfully demonstrated its new memory model in a Xilinx FPGA. The company is now on the hunt for investors to fund the development of a chip.We spoke to Peter Marosan, CTO of Blueshift Memory, to find out exactly what the company is trying to do. It is essentially optimizing the memory architecture so that large data sets and time-critical data can be more efficiently handled, hence speeding up memory access speeds up to 1,000 times for specific data-focused applications.He said, “We use DRAM as the main memory (not Flash) and store the data in a different way inside the memory by changing the wiring in the memory module. Current memory modules are too general; our solution is targeted at time-critical data and large data sets.”Marosan said the new memory design is one in a wave of radical changes in computer memory emerging from different companies around the world, which aim to address the struggle for high performance computers to keep pace with society’s spiraling data demands. He said computer memory chips (usually RAM) are just not improving as quickly as their central processing units (CPUs).This creates a ‘tailback’ in processes where high-performance computers perform large-scale operations, like database searches with millions of possible outcomes. Data stacks up in a slow-moving queue between the CPU and the less-efficient memory. Blueshift said its new design reorganizes the way in which a memory chip handles these operations, so that it delivers data to the CPU much faster. With it, operations could take minutes, or even seconds, rather than hours.Blueshift’s team analyzed and categorized thousands of algorithms used by companies to solve complex data problems. They then designed the chip so that it arranges data in preparation for these tasks — an approach that could be combined with any type of memory cell technology.Its initial model implemented in an FPGA to emulate the chip’s effects has yielded some impressive results, according to Blueshift. Simulations using this card suggest that the chip could, for example, make searches of vast databases used to match fragments of DNA in scientific research, or in criminal investigations, 100 times faster. In other tests, algorithms used in weather forecasting and climate change modelling could also run 100 times faster using the chip. Better memory chips could also accelerate the more data-hungry aspects of home computing. Blueshift’s prototype makes rendering films in video editing software 10 times faster, for example; it could also improve the processing speeds of virtual reality headsets by a factor of up to 1,000.The company said its design could also make it much easier to program some data operations, because it would remove the need to include complex instructions about how to handle the vast quantities of data involved. “It would make some big data programming as straightforward as the basic data searches that computing students learn to write in high school,” Marosan said.For example, the artificial intelligence (AI) in autonomous vehicles needs to process huge quantities of data quickly to make decisions. Or in connected in smart cities, fast, real-time data processing on a large scale will be essential to manage traffic flows, utility supplies, and even evacuation procedures in times of danger.Once the company manages to validate its own chip, it then plans to license its technology to memory module manufacturers. Marosan said, “Our strategy is ready, our prototype is ready, and we know who our partners will be. We now just need the funding to create the chip.”Marosan told us they are having conversations currently with DRAM and FRAM manufacturers, and also looking to speak with high bandwidth memory (HBM) makers."
Intel Shows Next Steps in PackagingRick Merritt,https://www.eetimes.com/document.asp?doc_id=1334899,https://m.eet.com/media/1312645/IntelCoEMIBcover-min.png,SoC Designline,07.09.19,"SAN FRANCISCO — Intel gave a first glimpse of three packaging technologies on its roadmap at a gathering on the sidelines of Semicon West here. The most interesting of the three may debut in the exascale supercomputer Intel is building for the U.S. Department of Energy.The trio of techniques aim to give Intel’s processors an edge at a time when advances in conventional silicon scaling are slowing and getting more expensive. They arrive as rival TSMC expands its portfolio of chip stacks, and two consortia hope to set standards in the area.MDIO is the next-generation of Intel’s AIB, a physical interface for stacking chiplets it released last year as part of a DARPA program. Intel claims MDIO is on par with advances rival TSMC announced last month. It will use the interface in chip stacks starting sometime in 2020 but has not decided if it will make the spec open.The most interesting of the three new techniques is Co-EMIB. A combination of Intel’s latest 2D and 3D stacking techniques, it likely will see its first use as a way to link CPU and GPU cores in the Aurora supercomputer Intel and Cray won a $500 million contract to deliver before the end of 2021.Prototypes shown here of Co-EMIB wafers and devices stacked 18 small die on one large one using the Foveros 3D technique Intel announced in December. Two of the devices were then connected using four of its Embedded Multi-die Interconnect Bridge (EMIB) links using 45- and 55-mm bump pitches.Intel has shipped as many as a million devices using EMIB in Stratix X FPGAs and Kaby Lake G, an integrated CPU/GPU module. Next year it will ship Lakefield, an integrated notebook processor slated to be its first chip using Foveros.Currently,Intel suffers transport delays making the face-to-face Foveros stacks because the process is split between a front-end line in Oregon and a back-end line in Arizona. Once it moves the process to one location, turn around times should be about two weeks.The third new option is so far just a research project. Omni Directional Interconnect (ODI) is a 70mm thick vertical link for delivering power to a chip.Next page: Packages with 2X reticle dice on the horizonNext page: Packages with 2X reticle dice on the horizon"
"A Week in European Automotive: Reinventing the Car, Last Mile RobocarsNitin Dahad",https://www.eetimes.com/document.asp?doc_id=1334900,https://m.eet.com/media/1312650/REEFlatChassis.png,Automotive Designline,07.09.19,"“We’re disrupting the automotive industry!"" That’s a common claim from many briefings we get from emerging startups. Last week was not unusual — one told us how they’ve solved the challenge of producing roadworthy autonomous delivery vehicles for last mile delivery; another has ‘reimagined’ the vehicle by integrating all the components found under the hood of a car into the wheel.Both are at early stages; both claim investment interest from retailers and Tier 1s in the automotive manufacturing supply chain.A Modular EV Platform, All Built into The WheelA Modular EV Platform, All Built into The WheelIsraeli startup REE, which came out of stealth mode today, has a flat and modular platform that fundamentally changes the way electric vehicles (EVs) will be built. The company integrates all of the components formerly found under the hood into the wheel. It says it offers optimal freedom of design, and the potential for multiple body configurations on a single platform.Putting the motor, steering, suspension, drivetrain, sensing, brakes, thermal systems and electronics in the wheel leaves a ‘flat’ platform. This provides a low center of gravity to maximize efficiency and supports the vehicle’s agility and stability. The design also drastically reduces its footprint, weight, and improves both energy-efficiency and performance — aspects crucial for electric and autonomous vehicle development.In an interview with EE Times, Daniel Barel, co-founder and CEO of REE, told us, “The industry is still using 80-year old concepts for car design, even though the technology has changed. There have been many advances, but these have still only been incremental, and it doesn’t make sense to build EVs based on these old concepts.”He said they wondered, “What if we could build a rolling chassis platform that is modular and would still be appropriate even one hundred years from now?” He added that the single biggest expenditures for an OEM was the platform, which can cost billions of dollars, which is why they started developing a platform that could support any shape and size of car.REE’s platform provides automakers, mobility providers and delivery companies a tailor-made solution. Based on a novel quad-motor system, and including active height-levelling suspension, steer-by-wire and a smart quad-gear box, the technology provides the basis of any type of vehicle from a high performance car able to do 0-60 mph in less than 3 seconds to an off-road SUV with advanced active suspension technology. The platform can also be used as the base of a robotaxi or even a 10-ton cross country truck.By adopting a universal framework, this can replace the multiple platforms that OEMs develop, resulting in substantial savings. The design and validation of each platform traditionally costs manufacturers $20 billion. By enabling them to utilize one platform for all of their vehicles, costs could be slashed, while performance, safety, comfort and energy efficiency can all be matched or improved.Barel said they’ve been validating the technology for the last six years in stealth. In early 2018, they established some initial discussions with a Tier 1 and an OEM to gauge interest. “They loved our idea and became investors and also wanted us to expedite what we were doing.” Since then, REE has been building its network and establishing relationships with players such as Mitsubishi, NSK, Tenneco and FCA. The company is essentially the system integrator, developing both the hardware, including electronics, and software, selling its wheel to the tier one manufacturers and OEMs.Although Barel wasn’t prepared to disclose funding to date, he said it’s sub-$100 million. The company employs around 100 people, 50 of whom are based in Israel. He added that the full solution will be presented with its partners later this year and manufactured globally. Barel is also co-founder of SoftWheel, a developer of in-wheel suspension technology for personal mobility, which has raised $40 million to date and announced investment from Mitsubishi Corp. last year.Next page: ‘First’ Roadworthy Last Mile Autonomous Delivery Vehicle Next page: ‘First’ Roadworthy Last Mile Autonomous Delivery Vehicle "
