title,url,image,category,date,content
Flexible RFID ICs To Tackle Counterfeit Consumer GoodsNitin Dahad,https://www.eetimes.com/document.asp?doc_id=1334853,https://m.eet.com/media/1312375/newpragmatic_flexics.jpg,Internet of Things Designline,06.24.19,"Chinese packaging materials firm BSN intends to use flexible electronics firm PragmatIC’s RFID ICs in a new printing facility focused on anti-counterfeit solutions for fast-moving consumer goods (FMCG), online sales, and pharmaceutical drugs.BSN is part of the Baoshen Group, one of China’s leading packaging material suppliers for footwear, apparel, bags, furniture, cosmetics and accessories, with an annual capacity of 7 billion print items and 1 billion RFID labels. PragmatIC’s ConnectIC products will be used in BSN’s new Eprint line of RFID products.The ConnectIC family, released earlier this year, provides connectivity solutions using HF RFID proximity identification aimed at smart packaging, and targets markets such as food and beverage, personal and home care, pharmaceutical and healthcare.The RFID elements are thin and flexible, making them suitable for embedding into a wide range of substrates, including plastic or paper. The company claims they are imperceptible when added to labels or packaging. With integrated energy harvesting and designed for use with single layer antennas, they are designed to minimize total system cost.Headquartered in Cambridge UK, PragmatIC says the low cost of these flexible ICs means electronic connectivity is no longer limited to high-value luxury items. The company contends its technology now makes it economical to add ""smart"" features such as traceability and interactivity to high-volume FMCGs and other mass market applications.The ConnectIC series facilitates rapid detection of objects when one or more low-cost custom readers are integrated into the system. Designed for proximity identification applications, the ICs can then enable applications such as hierarchical inventory management, item identification and tracking, supply chain assurance and brand authentication. Scott White, CEO of PragmatIC, said, “The ConnectIC family is set to bring connectivity to items we buy every day.”BSN’s RFID consultant Philip Calderbank commented, “We see rapidly growing demand in Asian markets for solutions to protect brands and consumers from counterfeit products both in store and online. PragmatIC’s ultra-low-cost technology will enable us to roll out solutions to a much wider range of market segments than possible with conventional electronics.”"
UltraSoc Gets $6.3M for Hardware-Level CybersecurityNitin Dahad,https://www.eetimes.com/document.asp?doc_id=1334854,https://m.eet.com/media/1312376/UltraSocbaremetalsecuritydiagram.png,Test & Measurement Designline,06.24.19,"UK-based embedded analytics firm UltraSoC has secured £5m (about US $6.3 million) in new funding to target hardware level cybersecurity, hire more hardware and software engineers in the UK, and open a data science and machine learning engineering center in Warsaw, Poland.UltraSoC said it had already established itself as a solution for semiconductor companies needing to understand how their system-on-chip (SoC) products are behaving. While this results in reduced development and debug costs, those same customers are also recognizing the potential for its technology in implementing functional safety and cybersecurity features.CEO Rupert Baines commented, “This funding round will enable us to grasp that opportunity, which I believe we are uniquely equipped to address.”The company said its approach to cybersecurity places anomaly detection directly into the silicon, enabling hardware-based threat detection. This can identify attacks very quickly – in microseconds rather than milliseconds. Also, since it is ‘below the OS’, it is therefore very hard for an attacker to detect, circumvent or subvert.Baines told EE Times, “We can efficiently build a monitoring and communications infrastructure that functions independently from the main system. So, that in itself provides an extra layer of security, over and above standard techniques: an addition to the single root of trust provided by standard systems.” He said UltraSoC enables a system to be configured that functions entirely non-intrusively, if that is needed. “Our monitors react at hardware speed, so we can respond very quickly indeed (microseconds), if an intrusion takes place.” EE TimesHe added “We can also build ‘smarts’ into the hardware — I can’t say too much about that at the moment, because it’s very definitely a highly differentiated proposition. We’ve shared these concepts with partners and security experts who assure us that what we can do is genuinely unique.”In addition to hiring engineers at its headquarters in Cambridge, UK, and design center in Bristol, UK, it also plans to open an engineering center in Warsaw, Poland to develop its data science and machine-learning technologies. Baines told us that Warsaw and Krakow have excellent strength in data science, and this will be a major focus for the design center as the company looks more into how it can help its customers and their customers to make use of the rich data it collects from chips.The Polish center will be headed up by UltraSoC’s director of system engineering Marcin Hlond, who was previously with Blu Wireless and Icera before joining UltraSoC in 2017 to head up the company’s Bristol, UK, engineering team.  Baines told us it was serendipitous that Hlond was looking to move ‘back home to Poland’ just as UltraSoC was looking to establish a presence in the European Union.With the funding, UltraSoC also aims to expand customer support and commercial presence in Europe, the USA, Japan and China. In total, Baines said it plans to double the size of its workforce by the end of 2020, from its current 35 people.UltraSoC said it has had a successful period of growth and new technology developments within the last year, both in terms of revenues and licensees. Baines said they don’t quote revenue, but the firm now has 20 licensees. He commented, “The technology is also very ‘sticky’, so we have a 100% retention rate – our customers invariably become repeat customers.” Early in 2019, it announced data storage firm Seagate had licensed its technology, and that it is supporting Western Digital’s SweRV processor architecture. It also recently announced Alibaba company C-SKY, Esperanto, Kraftway and Microchip as customers. Its core technology improvements include development of its architecture to address high-performance computing and exascale systems, a solution targeting automotive lockstep applications, and an expanded ecosystem for heterogeneous designs incorporating the RISC-V open source architecture, and new patents.UltraSoC’s latest funding brings the total amount raised to £19 million, and this round brought in cybersecurity-focused venture capital firm eCAPITAL, and Seraphim Capital, a specialist investor in the space ecosystem. They joined earlier investors Indaco Venture Partners, Octopus Ventures, Oxford Capital, Techgate, and business angel Guillaume d’Eyssautier."
iBASEt & Amazon Collaborate on Aerospace & Defense Manufacturing Platform Hailey Lynne McKeefry,https://www.eetimes.com/document.asp?doc_id=1334840,https://m.eet.com/media/1312304/iBASEt_Blog-Banner-f35.jpg,Military & Aerospace Designline,06.21.19,"Software vendor iBASEt is collaborating collaboration with AWS, as part of Amazon Web Services’ Smart Factory program, to bring a cloud-based Digital Manufacturing suite for aerospace and defense manufacturers using AWS. “iBASEt is working with AWS to bring the iBASEt Manufacturing Suite on AWS GovCloud where more stringent requirements are in place to protect the data,” Sung Kim, chief technology officer of iBASEt told EETimes.Aerospace and defense customers, who are contending with extensive regulations, can use the platform to efficiently leverage native services to create and deploy applications and perform platform updates. A platform approach allows discrete manufacturers in the aero/defense space to have better visibility and control, while lowering cost of ownership and increasing security.“By working with AWS, either on commercial or GovCloud, our clients will be able to fully leverage a cloud environment to drive greater efficiency and control over their manufacturing operations and the digital thread,” “The cloud creates a powerful infrastructure to leverage a range of native services that drive seamless adaption of different technologies, connecting operations and sustainment management in a seamless flow of data across the value chain and product lifecycle.” In addition, the platform provides enhanced platform management troubleshooting, automatic software updates and simplified implementation, the company said. “In a cloud environment, iBASEt’s manufacturing solution will leverage AWS best practices for security and high availability in an environment that also supports quick deployment using automated processes,” said Dr. Josef Waltl, global segment lead for Industrial Software at Amazon Web Services. Amazon Smart Factory provide cloud-based infrastructure to organization’s working toward factory automation.  “AWS brings the best practices of putting enterprise applications in cloud, which allows for greater efficiency for manufacturers,” said Kim. “iBASEt is leveraging native AWS services and utilizing them to provide higher levels of performance and scalability.” The AWS service includes AWS Cloud IoT Services, edge computing, data lakes, and advanced analytics tools to improve manufacturing operations by capturing, harmonizing, analyzing, visualizing, and executing on silo'd plant floor data, leading to improvements across critical KPIs such as quality, yield and Overall Equipment Effectiveness (OEE), according to Amazon.  AWS also helps manufacturers leverage AI and Machine Learning for real time and predictive analytics capabilities.Amazon’s AWS Quick Start program can be used with the iBASEt Manufacturing Suite to simplify deployment as customers trying to move to the cloud. “Unlike other solutions, iBASEt provides manufacturers with a platform to deploy a variety of applications and manage regular platform updates more efficiently, which enables discrete manufacturers in the A&D market to have better visibility and control of their operations and simplified implementation in a complex, highly regulated industry,” said Kim.The digital manufacturing suite is being used by some well-known names in the aerospace and defense customers.  Last April, iBASEt announced contract agreement with aerospace company Lockheed Martin, which is using the platform as its next-generation manufacturing execution system (MES) for its Aeronautics division, which designs and manufactures military aircraft.   "
Volvo Group to use Nvidia AI for Autonomous TrucksNitin Dahad,https://www.eetimes.com/document.asp?doc_id=1334847,https://m.eet.com/media/1312328/190618-Volvo-NVIDIA-7.jpg,Automotive Designline,06.21.19,"Gothenburg, Sweden — As the industry hype over autonomous vehicles moves into the realms of reality, or what’s really possible in the near term, one area where it could really have great immediate impact is in the freight industry. Recognizing this, Volvo Group and Nvidia have partnered to use the latter’s artificial intelligence (AI) platform to deploy autonomous trucks.Volvo Group announced this week it is using Nvidia’s Drive end-to-end autonomous driving platform to train, test and deploy self-driving AI vehicles, targeting public transport, freight transport, refuse and recycling collection, construction, mining and forestry.They will co-locate engineering teams in Gothenburg and Silicon Valley to build on the Drive AGX Pegasus platform for in-vehicle AI computing and utilize the full Drive AV software stack for 360-degree sensor processing, perception, map localization and path planning. They will also test and validate these systems using the Nvidia Drive hardware-in-the-loop simulation platform.Jensen Huang, Nvidia founder and CEO, said the Volvo Group partnership was a landmark for the future of transportation. Together with Volvo Group CEO Martin Lundstedt, they said AV technology applied to an entire lineup of trucks operating around the world can bring enormous benefits for industries ranging from public and freight transport to forestry and construction, to become more efficient, with vehicles that can work longer and travel farther.Online shopping and transport  Autonomous trucks address the demands of today’s online shopping, which put huge stress on transport systems — especially with expectations for overnight or same-day deliveries. More than 35 million packages worldwide are delivered each day, and this is growing up to 28% percent annually. By 2040, delivery services will have to travel another 78 billion miles each year to handle goods ordered online, according to consultancy firm KPMG.Online shopping and transport Autonomous trucks can potentially help meet this demand. They can operate 24 hours a day, improving delivery times, and with increased efficiency, can bring down the annual cost of logistics in the U.S. by 45% — between $85 billion and $125 billion, according to experts at McKinsey.From automating short, routine trips like the loading and unloading of containers on cargo ships and managing port operations, to autonomously driving on the highway, Volvo’s new generation of vehicles could help streamline the shipping industry. By using the Nvidia Drive solutions within the second-largest truck maker globally, Nvidia and Volvo Group say they can bring the efficiencies of autonomous trucking to the transport industry.Volvo Group will be utilizing Nvidia Drive Constellation to test and validate AVs, ensuring they can handle diverse operating challenges all over the world. By utilizing hardware-in-the-loop simulation, the companies can test the autonomous driving systems on the same hardware and software that will run in the vehicle, at a significantly greater scale."
Facial Recognition: The Ugly TruthSally Ward-Foxton,https://www.eetimes.com/document.asp?doc_id=1334831,https://m.eet.com/media/1312257/Trueface-800x6001.jpg,AI & Big Data Designline,06.20.19,"The UK is one of the most surveilled countries in the world, with closed-circuit televisions (CCTV) cameras everywhere, from shops to buses to private homes. In the last couple of years, AI techniques, such as neural networks, have propelled large-scale automated facial recognition. Combined with the UK’s huge network of existing CCTV cameras, this could hold vast potential for security applications.Our technological capabilities are developing faster than are the laws that dictate how they can be used. There are also many gray areas that require a lot of deliberation. With this set of articles we examined the technology and what we can do with it, and consider what we should do with it.Our technological capabilities are developing faster than are the laws that dictate how they can be used. There are also many gray areas that require a lot of deliberation. With this set of articles we examined the technology and what we can do with it, and consider what wedo with it.  However, there are worrying implications for privacy. Biometric facial data taken from photos or CCTV footage is particularly troubling because it can be taken without the person’s consent and without them knowing about it. This data may be collected indiscriminately — whether the subject is matched with a watch list or not — and it allows people to be located and for their movements to be tracked. It’s easy to imagine photos of crowds with every face linked to the person’s identity, then potentially connected to all kinds of other data about them. A promotional picture for NEC’s NeoFace facial recognition technology. (Source: NEC) A promotional picture for NEC’s NeoFace facial recognition technology. (Source: NEC)Law Enforcement  If we are going to trade our privacy for increased security, the benefits must outweigh the costs. Is facial recognition technology actually effective in catching criminals?Law Enforcement Police forces around the UK have performed trials of live facial recognition technology in public places such as shopping malls, sports stadiums, and busy streets. The Metropolitan Police have undertaken 10 trials of the technology so far, using dedicated camera equipment along with NEC’s NeoFace algorithm, which measures the structure of each face, including distance between the eyes, nose, mouth, and jaw. According to NEC, this algorithm can tolerate poor quality image such as compressed surveillance video, with the ability to match images with resolutions as low as 24 pixels between the eyes.Despite winning four consecutive NIST FIVE (U.S. National Institute of Standards and Technology, Face in Video Evaluation) awards for performance, NeoFace didn’t do terribly well in the field. In the eight deployments between 2016 and 2018, 96% of the Met’s facial recognition matches misidentified innocent members of the public as being on the watch list.A major criticism of the trials has been that the public were not sufficiently alerted to them and were not given the opportunity to opt out. The BBC filmed one passerby in North London covering his face — the police photographed him anyway and gave him a £90 fine for disorderly conduct. A South Wales Police van with facial recognition cameras. Text on the side of the van reads “Facial recognition fitted” in English and Welsh, but vans used by the Metropolitan Police were less clearly marked. (Source: Liberty) A South Wales Police van with facial recognition cameras. Text on the side of the van reads “Facial recognition fitted” in English and Welsh, but vans used by the Metropolitan Police were less clearly marked. (Source: Liberty)South Wales Police’s more extensive trials of the technology were marginally more successful: only 91% of matches were misidentifications of innocent members of the public. Images of all passersby, matched or not, were stored by the police for 31 days.This trial prompted one member of the public to take legal action against South Wales Police, having been photographed while out shopping and while at a peaceful anti-arms protest. He claims that automated facial recognition technology violated his right to privacy, interfered with his right to protest, and breached data protection laws (judgment is due this fall)."
