title,url,image,category,date,content
"Xilinx Ships Heterogeneous Chips for AI, 5GSally Ward-Foxton",https://www.eetimes.com/document.asp?doc_id=1334898,https://m.eet.com/media/1312612/CAROXilinxVersalBlockDiagram.jpg,Programmable Logic Designline,07.08.19,"LONDON — Xilinx has shipped the first Versal devices to select customers as part of its early access program, a milestone for the company’s heterogeneous compute architecture. Versal devices use Xilinx’s adaptive compute acceleration platform (ACAP), part of the company’s strategy for modern workloads including high speed networking, 5G, and artificial intelligence (AI). Xilinx has shipped its first Versal ACAP device (Source: Xilinx)  Xilinx has shipped its first Versal ACAP device (Source: Xilinx) “Having our first Versal ACAP silicon back from TSMC ahead of schedule and shipping to early access customers is a historic milestone and engineering accomplishment,” said Victor Peng, president and CEO of Xilinx, in a statement. “It is the culmination of many years of software and hardware investments and everything we’ve learned about architectures over the past 35 years.”Built on TSMC’s 7-nm FinFET process technology, the first devices to ship are from the Versal Prime series (for a variety of applications) and the Versal AI Core series (for acceleration of AI inference workloads). According to Xilinx, the AI Core series can outperform GPUs by 8X on AI inference (based on sub-2ms latency convolutional neural network performance versus Nvidia V100).In an interview with EETimes Europe, Xilinx’s Nick Ni, director of product marketing for AI, software and ecosystem, said that in the AI accelerator market in particular, there is a lot at stake.“Everybody is betting on something, including [established players] and ASIC startups … we think this is an intelligent bet,” said Ni. “The truth is, nobody has captured the market in AI … it’s just really getting started. Everyone agrees the hardware will be the bottleneck of mass deployment — whoever gets the hardware right for this moving target workload, which is very hard to design for, [will win the bet].” Heterogeneous Compute  Ni said that the rapid pace of innovation in fields such as neural networks and artificial intelligence have so far left hardware running to catch up. Heterogeneous Compute “Developing an ASIC for this market might take a couple of years to develop, verify, and go to market — by then the workload has completely changed,” he said. “When workloads continue to change, efficiency goes down, or you can’t [continue to] support the feature sets needed. … With AI workloads, which require low power and high efficiency, you need domain specific architecture, that is, you need a specific accelerator for each problem that you have.”AI workloads are notoriously diverse and fast-moving in terms of structure. While all neural networks require huge amounts of compute and a lot of data transfer between different multiply-accumulate units (MACs), even basic image recognition workloads differ vastly depending on which neural network is used.“FPGAs have always been in the sweet spot of being able to work on all sorts of workloads efficiently,” he said. “AI has pushed us to the point where that is nice, but it’s not good enough: you really need ASIC-like performance in some portions of your workload, and you also need some flexibility to adapt to the latest innovations.”To accelerate neural networks efficiently in hardware, three things have to be customized for every AI network, Ni explained.First, the data path has to be customized. Data paths vary from the simplest feed-forward networks (e.g., AlexNet) to more complex paths with branches (e.g., GoogleNet), to the latest networks with skip connections and merging paths (e.g., DenseNet).Second, is precision. The less precision you use, the more power you save, which is important for inference on edge devices; AI workloads have different “sweet spots” in terms of the number of bits required.Third, how do you move data around the chip?“Many chip [makers] say they have huge peak performance, but if you can’t pump the data into the engine fast enough, most of the time it’s sitting idle,” said Ni. “The [pace of] innovation of AI is making this part difficult because the more complex the neural networks become, the more complex the data flow becomes, and how you move the data from memory to the engine and back efficiently becomes the bottleneck. This has to be customized for every network.” Domain Specific Architecture  Xilinx’s vision for neural network acceleration is a domain specific architecture in which the data path, precision, and memory hierarchy can all be customized. Domain Specific Architecture “We are pushing from general purpose architecture, from CPUs and GPUs, into special hardware architectures for each problem … creating a custom system for each problem,” he said. “That’s extremely difficult for GPUs and ASICs, but it’s easier for FPGAs as we can reprogram the different hardware architecture for each [neural network].” Xilinx ACAP platform combines programmable logic, CPU cores, DSP engines, and AI accelerator engines (Source: Xilinx)  Xilinx ACAP platform combines programmable logic, CPU cores, DSP engines, and AI accelerator engines (Source: Xilinx) Versal is the first device built on Xilinx’s ACAP. ACAP combines scalar processing blocks (a dual core ARM Cortex-A72 application processor and an ARM Cortex-R5F real-time processor) with adaptable hardware engines (its new name for programmable logic) and intelligent engines (specialized DSP and AI engines), plus memory and interfaces.The AI engine is “basically AI ASIC hardware — it has more flexibility to it [than an ASIC] but it achieves hundreds of TOPS for AI workloads,” Ni said. Up to 400 of these inference engines are included on the Versal AI Core devices.In between the blocks is a software programmable multi-terabit network-on-chip which enables data transfer between the engines, the memory, and the interfaces.“This has been one of the choking points for FPGAs in the past, routing between different logics could degrade the performance, and having an actual ASIC — ahardened network-on-chip topology — we can move the data at a very fast speed, like gigahertz kinds of speed,” said Ni.—  Software Programmability  While FPGAs traditionally had their own specialist programming languages, today’s AI accelerators will need to be accessible to both software and hardware developers and data scientists. Software Programmability “As a company, we have invested significantly in bringing up the ease of use of software tools and frameworks for AI and software,” said Ni, referring to Xilinx’s purchase of Chinese AI startup DeePhi last year.“If we want to go after AI and software developers, we have to support C, C++, OpenCV, OpenCL — those kinds of languages. Then for AI developers, new languages like Python, Caffe, TensorFlow. … We are transforming the way we are hiring more software [people] and investing into tools and frameworks.”Available solutions include Xilinx’s DNNDK and ML Suite platforms, which can compile deep learning frameworks for FPGA boards without writing any C code or RTL code, Ni said.“We will continue to enhance this in the future and import it to Versal,” he said.Versal currently comes with its own development environment with a software stack that includes drivers, middleware, libraries, and software framework support. The Versal AI Core and Versal Prime series will be available in the second half of 2019."
IoT Nets in Two-Horse LPWAN RaceRick Merritt,https://www.eetimes.com/document.asp?doc_id=1334892,https://m.eet.com/media/1312576/LPWANIHScover-min.png,Internet of Things Designline,07.05.19,"SAN JOSE, Calif. — LoRa and cellular’s Narrowband-IoT (NB-IoT) are far ahead of a pack of low-power wide-area networks (LPWANs) staking out early design wins in the internet of things. The LTE-M version of 4G cellular is a distant third, and Sigfox trails, according to a new report from IHS Markit.The report suggests that a once wide-open field is beginning to narrow significantly. However, it’s still early days. IHS estimated that just 150 million LPWAN links were deployed in 2018, a figure that it expects to expand at a 63% compound annual growth rate to hit 1.7 billion links by 2023.It’s also worth noting that some alternatives are just emerging from the lab. For example, multiple vendors are shipping their first chips this year for a 900-MHz version of Wi-Fi called HaLow that’s expected to hold significant promise for long-range connections. And last year, research institute CEA-Leti announced early work on a new option based on a patented Turbo-FSK waveform.That said, IHS forecasts that NB-IoT and LoRa could claim 86% of all LPWAN links in 2023. “We think it is a two-horse race by 2023, with LoRaWAN more in private and NB-IoT mainly in public networks,” said Christian Kim, one of the authors of the report.Interestingly, Huawei’s HiSilicon division is the leading supplier of today’s NB-IoT chips, 90% of which are deployed in China. Taiwan’s Mediatek is second, and China’s RDA Unisoc is third in NB-IoT silicon. NB-IoT had its origins in technology from U.K. startup Neul, acquired by Huawei in 2014.The relatively sluggish market for LTE-M chips is led by Qualcomm, followed by Sequans and Altair. Semtech is by far the dominant supplier of LoRa chips, the current market leader among LPWANs.Overall, 54% of last year’s LPWAN deployments were in China versus about 23% each in the Americas and the EMEA region. Government-backed smart-city projects in China are driving NB-IoT today with deployments in smart meters, parking meters, and streetlights.“Most projects are using government money,” said Kim. “A lot of enterprises have not warmed to NB-IoT, even in China.”To some extent, the LPWANs are solutions seeking problems. IHS currently tracks 20 use cases proposed for the links.The China government is promoting use of NB-IoT in smart homes for electronic locks, smoke detectors, and other uses, and Huawei has talked about its use in agriculture for more efficient dairy farms. However, it has not yet taken hold in such applications to date, Kim said.In the U.S., Wi-Fi and Bluetooth by far dominate in the smart home. And in developed countries, dairy farms are already operating at high efficiency levels, he added.Next page: Sequans, IHS have different views of LTE-MNext page: Sequans, IHS have different views of LTE-M"
NYU Abu Dhabi Chip Processes Encrypted DataNitin Dahad,https://www.eetimes.com/document.asp?doc_id=1334893,https://m.eet.com/media/1312580/CoPHEEexperimentalsetup_image1.jpg,MCU Designline,07.05.19,"Researchers at NYU Abu Dhabi (NYUAD) have designed a co-processor that relies on partially homomorphic encrypted (PHE) execution, enabling it to perform computations directly on encrypted data.Processors in PCs and smartphones currently compute on ordinary, unencrypted data only. The new processor, CoPHEE, mitigates data leakage and limits threats and vulnerabilities from hackers, by computing directly using encrypted data without decryption. The project is led by NYUAD assistant professor of electrical and computer engineering Michail Maniatakos, with contributors including research engineers at NYUAD’s center for cyber security (NYUAD CCS) Mohammed Nabeel and Mohammed Ashraf, NYUAD CCS post-doctoral associate Eduardo Chielle, and NYU alumni and assistant professor of electrical and computer engineering at the University of Delaware, Nektarios Tsoutsos. The project is funded by GlobalFoundries, which is owned by Mubadala, an investment firm based in Abu Dhabi.In a paper presented earlier this year at the IEEE International Symposium on Hardware Oriented Security and Trust (HOST), the NYUAD researchers said ASIC designs for encrypted execution impose unique challenges. They include the the need for non-traditional arithmetic units (modular inverse, greatest common divisor), very wide datapaths (2048 bits), and the requirement for secure multiplexer units enabling general-purpose execution on encrypted values. Even solutions like Intel SGX require the data to be processed as plaintext, which renders the entire microprocessor core and cache memories vulnerable to hardware Trojans and side channel attacks.To address this, the CoPHEE processor enables PHE encryption execution. It is a fully functional co-processor chip, and communicates to a main processor via UART. It was fabricated at GlobalFoundries in a 65nm CMOS process. Specifically, the designers used the multi-project wafer (MPW) fabrication service from MOSIS. The IC has a die area of 9mm2 and a target frequency of 100 Mhz (constrained by the maximum speed of the provided I/O pads).The researchers said that if a system-on-chip approach is taken where CoPHEE is also located on the same bus, the communication with the main CPU would clearly be much faster than this experimental off-chip set-up. Assuming a 32-bit ARM architecture, on-chip communication on AHB-Lite would accelerate communication to around 9.65E-08 seconds per operation.The processor is instantiated using 2048-bit encrypted operands and can be readily used to accelerate a broad range of secure applications, such as voting protocols, threshold cryptosystems, watermarking and secret sharing schemes, as well as server-aided polynomial evaluation protocols. For this it incorporates special arithmetic units for modular multiplication (ModMul), exponentiation (ModExp), inversion (ModInv) and greatest common divisor (GCD). In addition, to extend support for ciphertext-based control flow decisions in PHE-protected algorithms, it adopts the Cryptoleq blueprint and instantiates a secure multiplexer in trusted hardware, effectively minimizing the required trust surface to a single operation.The arithmetic units for modular multiplication, exponentiation, inversion, and GCD accelerate the computation of very wide datapaths, while its secure multiplexer and true random number generator enables universal computation in the encrypted domain. In their paper, the team conclude, “To the best of our knowledge, CoPHEE is the first academic effort towards constructing a fast and reliable processor capable of processing encrypted data. This paper presents all required steps for a fully functional silicon, from the RTL design to fabrication and validation. Given the silicon, future work will explore side-channel analysis and information extraction through power, timing, and electromagnetic emissions.”Maniatakos adds, “Existing data protection solutions protect data at rest in our hard disks and data in transit over the internet, similar to Whatsapp’s end-to-end encryption. These solutions are not suitable to manipulate encrypted data i.e. perform operations directly on the encrypted domain. With this new processor, non-trivial encrypted data manipulation is a reality and anyone stealing our data from our computers can do nothing with it since everything is encrypted. We are confident that any smart technology using data can benefit from the new processor including PCs, personal tablets, and smartphones.”Next page: Homomorphic EncryptionNext page: Homomorphic Encryption"
Rockley Raises $52M for Silicon Photonics TechSally Ward-Foxton,https://www.eetimes.com/document.asp?doc_id=1334890,https://m.eet.com/media/1312568/CARORockleyPhotonicsTROSAOFC191.jpg,Internet of Things Designline,07.04.19," Transmit-receive optical subassembly (TROSA) for data communications using Rockley Photonics’ silicon photonics platform (Source: Rockley Photonics)  Transmit-receive optical subassembly (TROSA) for data communications using Rockley Photonics’ silicon photonics platform (Source: Rockley Photonics) LONDON — Rockley Photonics has raised $52 million in a first closure of its Series E funding round, from both current investors and new investors, including Morningside Technology Ventures of Hong Kong. Rockley’s silicon photonics technology builds optical transceiver components in silicon and co-packages them with digital electronics, such as a switching ASIC. This latest funding brings the total raised by Rockley to $165 million.Silicon photonics is particularly attractive for the data center market, where intra-data center links require increasing bandwidth and speed. Rockley is also targeting consumer sensors and LiDAR applications.Of the $52 million total, $30 million came from Rockley’s strategic partner, Hengtong Opto-Electric Co, a Chinese manufacturer of fiber optic cables. The companies have a joint venture, in Suzhou, China, where they manufacture and sell 100G and 400G DR4 transceivers for data centers using Rockley’s LightDriver Engine.“[Hengtong’s investment] is a direct investment in Rockley Photonics to support the entire business plan,” said Rockley Photonics’ CEO, Dr. Andrew Rickman. “There will likely be a portion of this amount going to the joint venture to support our activity there. The market outlook for 100G, and higher, in the Chinese market remains strong and will be well served by our joint venture.”Rickman also said that the money raised so far was “halfway to our $100 million goal for this round,” adding that the company is growing across the board, including its UK presence in Oxford.In an earlier interview with EETimes, Rickman described the company’s competitive advantage as a combination of several factors.The company has developed a unified silicon photonics platform that can be used across multiple market segments, including consumer sensors, LiDAR, and data center connectivity, he said.“Our value proposition is multifaceted. One of these facets is the versatility of the platform and the optimization vectors we can manipulate in both the electrical and optical domains, which makes it suitable for all of these market segments thereby helping us drive economies of scale,” he said.Rockley’s portfolio has been developed around optimal solutions for both optical and electrical domains, as well as at the interface of the two.“This drive, coupled with our intense system-level thinking regarding in-package optics, has positioned Rockley’s LightDriver approach as the most practical solution from a system perspective,” he said.Rickman added that Rockley’s in-package optics solution is switch agnostic: an advantage of the company’s systemic approach to in-package optics and silicon photonics in general, compared to other offerings.“This makes us an attractive partner for multiple customers on the switch and ODM side,” he said.According to Rickman, 400G DR4 transceivers using Rockley’s LightDriver technology will start shipping at the end of the year. "
Startup Automates Type 1 Diabetes ManagementNitin Dahad,https://www.eetimes.com/document.asp?doc_id=1334891,https://m.eet.com/media/1312575/Diabeloopdiabetesmanagementsystem.png,Medical Designline,07.04.19,"Dealing with chronic disease can be a big chore both for affected patients. As Erik Huneker, CEO of French medical device startup company Diabeloop said last week at the Leti Innovation Days in Grenoble, “A person with type 1 diabetes needs to think and make a decision about 40-50 times a day about how much to eat and how much insulin to take.”This makes management of diabetes a perfect candidate for the utilization of artificial intelligence. That’s why Huneker’s company has developed what he claims is the world’s first autonomous medical device, which uses machine learning in real time to determine the optimum insulin to administer automatically to a patient without them having to even think about it.Type 1 diabetes affects about 2 million people in Europe and what Diabeloop aims to do with its closed loop medical system is to help people with the condition try and live normal lives by improving their treatment dramatically.Huneker emphasized they’re not simply developing an app. Its system, the DBLG1, comprises a continuous glucose sensor, a patch insulin pump and a dedicated handset that houses the Diabeloop algorithm (loop mode) and serves as a user interface with the system. The handset has its own custom operating system and connects with the sensor and the insulin pump using  secure Bluetooth.The system senses and monitors the patient’s blood glucose every five minutes, analyzes the data in real time, and can inject the correct does of insulin before the patient even knows he or she needs insulin, since it monitors daily patterns and over time will have learned the optimal parameters for the patient. The continual assessment takes into account current glucose levels, glucose trend, the hypoglycemic risk (short and long term) and special events such as meals, physical activities, and calibration, to provide an optimal recommendation adapted to the needs of the patient.Huneker said, “For each person the system runs 150 million equations per day for the machine learning.”The company’s DBLG1 obtained CE marking certification in November 2018, and earlier this year entered into a mutual distribution agreement with Netherlands-based ViCentra, which provides the insulin delivery system used as part of Diabeloop’s product.The results of a trial with 68 patients was published in the Lancet Digital Health journal. It found that the DBLG1 system improves glucose control compared with sensor-assisted insulin pumps; it concluded that its finding supports the use of closed-loop technology combined with appropriate health care organization in adults with type 1 diabetes.One of the outcomes of the study was that patients spent 68.5% of their time in the target glucose range, meaning a 10 point increase in the time spent in the target glucose range. There was also a decrease by 50% of time spent in hypoglycaemia (<0.7 g / l), in other words, a gain of more than 30 minutes less per day in hypoglycaemia. A third conclusion was that a reliable closed-loop system that was functional for more than 84% of the time in a home setting for 12 weeks.While this is focused on adults and the system is already being used by around 30 patients, the company is now also looking to adapt its ‘artificial pancreas project’ to juvenile diabetes and thus improve the quality of life for each child in the short term and the long-term. A study will be conducted in two centers in France and one in Belgium. The goal is to include around 20 children who will be followed for 6 weeks.We asked Huneker why his company was using a standard handset rather than developing its own smaller integrated device and possibly its own system on chip. He stressed that to do that could have needed years of development and the company really needed to get something to market that could be trialed on patients. This is why they are using standard off-the-shelf components – like the Dexcom G6 continuous glucose monitoring sensor system and the Kaleido insulin pump.Huneker said that the big challenge right now is to be able to do more on the device. “We need more computing capability.” He suggested they are planning to integrate more sensors and more computing power, and maybe three years from now could even think about developing a more integrated system that could be incorporated in a wearable device.Diabeloop emerged from a medical research project initiated by diabetologist Dr Guillaume Charpentier in 2011; the company was established in 2015 with support from CEA-Leti in Grenoble to help develop the product. The company now has around 50 people and has raised €13.5 million to date."
