title,url,image,category,date,content
Applied Bids $2.2B for KokusaiRick Merritt,https://www.eetimes.com/document.asp?doc_id=1334882,https://m.eet.com/media/1312480/AMATKElogosinvert-min.png,SoC Designline,07.01.19,"SAN JOSE, Calif. — Applied Materials, Inc., bid $2.2 billion to acquire Kokusai Electric Corp. in a deal in line with the current conservative tone of acquisitions in the capital equipment sector. Kokusai’s vertical diffusion furnaces, which are mainly used by DRAM and NAND vendors, would add about 10% to Applied’s revenues.Kokusai grew about 42% in the memory boom of the past three years and logged an estimated $1.8 billion in 2018 revenues. But it is likely to take a significant hit from the current downturn among DRAM and NAND makers who are its major customers.Given its relatively modest size, the deal is likely to escape becoming another pawn in the China/U.S. trade war, analysts said. It requires regulatory approval in China, Ireland, Israel, Japan, and Korea but not in the U.S.“Applied has a long history and strong relationships in China — I visit there frequently — and we think the deal will be treated fairly there,” said Gary Dickerson, chief executive of Applied. He declined to break out Kokusai’s China revenues.Dickerson helped set off a series of bold but unsuccessful merger attempts in the semiconductor capex sector. Soon after he joined Applied in 2013, it bid to merge with Tokyo Electron in a deal that would have united the sector’s first- and third-largest players. In early 2015, the U.S. Department of Justice nixed the deal.Eighteen months later, regulators struck down a $10.6 billion merger between KLA-Tencor and Lam Research, putting a chill on capex deals despite a historic period of consolidation in the maturing semiconductor industry overall.In March 2018, KLA bid $3.4 billion for Israel-based Orbotech in a deal that closed in February with approval from China and others. Analysts said that the deal gave Applied confidence to bid on Kokusai.“We think it is very possible that the two companies will secure the required approvals within the expected 12-month time frame, though we think there is some amount of risk that there could be regulatory difficulties,” wrote analyst David Wong of Nomura Instanet in a research note.About 80% of Kokusai revenues come from tube chemical vapor deposition furnaces, where it holds an estimated 58.6% market share, Wong wrote. Tokyo Electron is the other big player in the area with a 38% share, while Applied currently has no products in the so-called batch-processing market.Next page: Deal could spark Lam bid for ASMINext page: Deal could spark Lam bid for ASMI"
Chip Sales Fall for Fifth Straight MonthDylan McGrath,https://www.eetimes.com/document.asp?doc_id=1334884,https://m.eet.com/media/1312512/semiconductor_1200_2-min.png,Automotive Designline,07.01.19,"SAN FRANCISCO — Global semiconductor sales declined on an annual basis for the fifth straight month in May but increased modestly on a sequential basis as the chip industry downturn continued amid an ongoing trade war between the U.S. and China.Chip sales fell to $33.1 billion in May, down 14.6% from the May 2018 total of $38.7 billion, according to the World Semiconductor Trade Statistics (WSTS), an organization of 45 major semiconductor industry member companies who pool sales data. Sales did improve by 1.9% compared to April’s total of $32.5 billion.RecommendedQ1 Chip Sales Drop Among Largest on RecordRecommendedQ1 Chip Sales Drop Among Largest on Record“Global semiconductor sales fell well short of last year’s monthly total in May, marking the fifth straight month of negative sales growth on a year-to-year basis,” said John Neuffer, president and CEO of the Semiconductor Industry Association, in a press statement. “On a month-to-month basis, global sales increased modestly and sales into the Americas increased for the first time in seven months, although year-to-year sales into the Americas were down substantially.”Sales declined on a year-to-year basis across all regions of the world, according to WSTS. On a month-to-month basis, sales increased in China, the Americas, and Japan but fell in all other regions.The semiconductor industry is widely expected to contract in 2019 after three straight years of market expansion as the memory boom that drove much of the growth in recent years has turned to bust and the world’s two largest economies continue to impose tariffs on each other’s exports. The WSTS is currently forecasting that global semiconductor sales will decline 12.1% to about $412 billion in 2019. "
Data Privacy Splits Global AI RaceJunko Yoshida,https://www.eetimes.com/document.asp?doc_id=1334876,https://m.eet.com/media/1312453/EmmanuelSabonnadiere_1200_nu-min.jpg,Internet of Things Designline,06.29.19,"GRENOBLE — In the world of AI research, Europe has drawn a line in the sand, declaring that R&D must focus squarely on “Edge AI.”This proclamation draws a stark contrast to “Cloud-based AI,” the model aggressively pursued by China and the United States. During “Innovation Days” hosted here by French research institute CEA-Leti this past week, Emmanuel Sabonnadiere, CEA-Leti’s CEO, discussed the “two schools of AI research” that have split the world in two.  Both the U.S. and China have been collecting massive amounts of data which they use for training AIs, the basis for their claims they lead the world AI race. Strict data privacy regulations in Europe might be seen as impeding European companies' progress in AI, but that's not necessarily the case. Conforming to those regulations is instead  “shaping Europe to manage its AI research strategy very differently,” said Sabonnadiere. Once AI is trained in the cloud, Europe sees its role as applying further learning and personalization to “Edge AI.”Is Europe behind in AI? This prompts the question of whether Europe is really lagging in the race for AI. The answer: not necessarily. To begin with, from a worldwide perspective, AI research is barely out of the starting gate.Is Europe behind in AI?It's easy to dismiss the notion of ""Edge AI,"" given that it's something plenty of companies say they're already doing. That's true to the extent that everybody seems to be slapping AI accelerators into smartphones and calling it “AI at the edge.”  To be clear, when CEA-Leti talks about ""Edge AI,"" this means its researchers are thinking about technology used in inferences that go way beyond current edge AI practices.Sabonnadiere explains that Edge AI is “a huge challenge,” one that Europe “absolutely must solve,” given that data privacy rules aren't going away.By definition, solving big challenges requires innovation. CEA-Leti and its researchers have laid out a 10-year roadmap for Edge AI. The technologies range from 3D stacking to in-memory computing and on-die integration of resistive non-volatile memories.  Advancements in such areas will help reduce energy per operation.The key to frugality with power consumption at the edge, said CEA-Leti's Francois Perruchot, is: “Do not move data,” from an external memory block to an AI processor. Every time data moves, AI power consumption spikes at the edge by 100 to 1000 times,"" he noted. Perruchot is director of strategic marketing on sensors at Leti.In parallel, reducing the number of AI operations at the edge is crucial. CEA-Leti is exploring a neuromorphic approach to data processing and spike-coding for deep neural network processing of sensor inputs.10 TOPS per watt The goal for CEA-Leti’s Edge AI research is to develop — over five years — “an Edge AI processor running at 10 tera-operations per second (TOPS) per watt,” said Sabonnadiere. This requires a combination of new memory architecture, spiking algorithms and sensor arrays. Once achieved, he said, “this will be a game changer.” It will be a sharp contrast to a typical current GPU running at 1 TOPS per 200 watts, according to CEA-Leti.10 TOPS per wattIn Sabonnadiere’s view, data privacy has created an R&D opportunity unique to Europe. This poses a constraint for European researchers, but it also forces them to tackle the issue head on, an arduous process the rest of the world has barely pondered. It remains to be seen if Edge AI will indeed enable Europe to win the global AI race, but at least it is a goal Europe can use to differentiate its AI research from the rest of the world.AI without hardware? CEA-Leti’s CEO regards as a huge asset its 50-year history of R&D deeply involved in testing and manufacturing of microelectronics.AI without hardware?AI research in Silicon Valley has profited hugely from algorithms advanced by technology platform companies such as Facebook, Google, Amazon and Microsoft. Further, Sabonnadiere acknowledged that AI research success by those Internet giants — “without spending big capital expenditures” — has spun the narrative that AI is ruled by AI software algorithms. However, he stressed that “AI without hardware” will eventually hobble AI’s potential.AI researchers in Europe are also cognizant that the overwhelming hype around AI among investors, media and the public could kill AI prematurely. Noting that the long history of AI has gone through cycles of “AI winter,” Sabonnadiere said, “We could face yet another ‘deep freeze.’”AI, he said, must stand on two pillars of discipline: ""Edge AI"" and ""Trusted AI.""AI that tells us ‘I don’t know’ By Trusted AI, he means, AI that respects privacy, can explain itself, and is responsible and reliable.AI that tells us ‘I don’t know’Patrick Gros, CEO of the Inria/Grenoble, French Institute for Research in Computer Science and Automation, explained AI bluntly. “AI isn’t intelligent. If there is any intelligence, it is in AI developers.” AI, in the simplest terms, can be explained as “brute force applied to data,” he noted. The probabilistic nature of AI could also make it problematic. The issue is not that AI makes the right decisions all the time. When the outputs of an AI decision miss predictions by a mile, “We need AI to tell us, ‘I don’t know,’” said Gros.AI’s confidence in its own decision-making greatly matters when AI is used in life-critical systems, be it an autonomous car, an airplane or a medical device.One good example is Diabeloop, a startup working in partnership with CEA-Leti. The company has developed a type-1 diabetes management system, already approved by regulators in Germany and France. It monitors a patient’s blood sugar and reproduces the pancreatic function. The startup’s CEO, Erik Huneker, told us that because diabetics have “immensely varied” lifestyles and needs for insulation injection levels, it’s important that the AI system “locally learn” the patient’s needs and “personalize” the system.Describing the system as “the first autonomous medical device that makes a decision,” Huneker said, “When AI’s decision deviates from predictions by 40 percent, the system shuts itself down. It would not send insulin automatically.” In other words, the device is run by two systems — an autonomous system to execute local learning and a deterministic system to prevent the AI-driven device from injecting the wrong insulin dosage.AI needs formal certification The factors that make AI system systems “less robust” and “unfair” are the incomplete data sets often used to train AI, Inria’s Gros added.AI needs formal certificationIt’s not enough for companies to say, “We did our best” to make AI reliable, stressed Gros. “We need to formally certify that [AI-driven] systems are fair.” Unlike smartphones that could miss an “event” or two in receiving sensory data, life-critical AI systems must be designed based on “ethical and legal AI frameworks,” said Gros. “And they must be “formally certified.”Next page: Global alliancesNext page: Global alliances"
5 Edge AI Projects Spotted at CEA-Leti EventNitin Dahad,https://www.eetimes.com/document.asp?doc_id=1334877,https://m.eet.com/media/1312462/spiritchip_1000-min.jpg,Internet of Things Designline,06.29.19,"GRENOBLE – CEA-Leti picked ""Deep tech for edge artificial intelligence (AI)"" as its theme for this year's Leti Innovation Days’ annual conference. The event last week, attended by 800 delegates from all over the world, took place during a blistering heatwave that saw outside temperatures of almost 40 degrees Celsius (104°F).Inside the Minatec campus, where lectures, workshops and demonstrations were held, attendees were reminded of significant challenges they would face by moving AI to the edge.Driving  such a move is none other than data privacy issues. Other factors prompting the industry to embrace edge AI, however, are their desire to reduce AI computation both in time and energy consumption. Data transfer and memory access would account for up to 90% of system energy usage, thus reducing data movement between memory and processor becomes critical.Recommended Data Privacy Splits Global AI Race Recommended Data Privacy Splits Global AI Race CEA-Leti, whose research focus includes health, environment and energy, strutted its stuff by showcasing a number of research projects and demonstrators during the event. Brought to the show floor were Leti's own research projects and others by startups working with or spun out of Leti.We will share five projects that caught our eyes in the following pages.Next page: Tracking Sleep Apnea in a WearableNext page: Tracking Sleep Apnea in a Wearable"
Private 5G Networks Expected to Boost Industrial IoTDylan McGrath,https://www.eetimes.com/document.asp?doc_id=1334872,https://m.eet.com/media/1312438/Sensors_Expo_2019_800_2-min.png,Internet of Things Designline,06.28.19,"SAN JOSE, Calif. — The rollout of 5G technology will have sweeping implications for the industrial IoT but won’t impact all IIoT applications in the near term, according to Gerardo Giaretta, senior director of product management and the head of Industry 4.0 at Qualcomm.5G will offer enormous benefits in areas like smart factories but won’t immediately be a solution for applications that are relatively simple and require massive-scale deployment, such as smart meters and many farming and agricultural applications, he said in a keynote address at the Sensors Expo & Conference 2019 here Thursday.Recommended5G, AI are Weapons in a WWIIIRecommended5G, AI are Weapons in a WWIIIMany of these applications will continue to rely on low-power wide-area network (LPWAN) derivations of LTE technology such as LTE Cat M and NB-IoT, which are more tailored to IIoT applications than general-purpose LTE and more well-suited for those use cases that don’t take advantage of the increases in bandwidth and speed offered by 5G, Giaretta told an audience of several hundred engineers.“Many use cases require a cost structure that 5G may not be able to achieve,” at least not in the next couple of years.5G — the fifth generation of cellular technology — is just now at the earliest stages of deployment, with carriers just beginning to offer the service in some locations and the earliest 5G handsets hitting the market. As the rollout progresses over the next several months, it is expected to offer enormous advantages in latency and speed, bringing mobile broadband access to smartphones and other mobile devices. But the implications for IoT and particularly IIoT may be just as profound, if not more so.Giaretta and others believe that the biggest impact of 5G on the IIoT could be the enablement of 5G private networks operating on factory premises. Private 5G networks within factories could enable companies to set up secure, dedicated networks within limited geographic zones that could be tailored for specific industrial applications.Some factories already use private networks built on LTE technology. But the 5G system architecture was designed with the private network in mind, enabling the deployment of standalone private networks that don’t rely on external networks. And unlike LTE, 5G offers multiple options for allocating spectrum to private networks, including the acquisition of licensed spectrum in a specific geographic area from mobile operators, the use of unlicensed spectrum with both synchronous and asynchronous sharing, and, in some countries, spectrum that has been specifically allocated for IIoT use.“It’s really the first time where we will see industry players — or, for that matter, smart city players — that will be able to deploy their own network, and that will free up innovation,” Giaretta said.He emphasized that secure spectrum for private 5G networks will still carry costs but said that the new model of deploying 5G networks will differ substantially from the current model for private networks, which requires a long-term deal with a telecom operator.The model is going to be “very, very different” because industrial players deploying 5G private networks for IIoT will be able to plan for their 5G network 10 to 15 years into the future “because they know that they kind of own it.”According to Giaretta, “It’s really, really a big innovation. It will have the potential to change completely the dynamics of factory networks.” "
Sensors See Big-Data OpportunityRick Merritt,https://www.eetimes.com/document.asp?doc_id=1334875,https://m.eet.com/media/1312446/SensormoduleST-min.jpg,Internet of Things Designline,06.28.19,"SAN JOSE, Calif. — A startup with a brainwave monitor powered by deep learning could help mobile and cloud-computing giants tap into your thoughts. The company was one of several device makers that responded at the Sensors Expo to a call from Google for smart home devices to support its Assistant service.Cloud services and smartphones probably won’t be monitoring thoughts anytime soon. However, the industry is clearly in a race up the food chain from core sensor technology to software and data, according to several vendors at the event.Petal uses off-the-shelf headsets that measure electroencephalogram signals that it processes with homegrown neural-network models written in Google’s TensorFlow framework. The two-year-old startup is currently demoing software that lets users play video games with their thoughts.The company said that Samsung responded positively to a demo that it conducted at Samsung’s Korean headquarters. The startup is seeking connections with Google’s home and embedded groups. The five-person company hopes to ship a developer’s kit within a month supporting Android, iOS, the Mac, and Windows.For its part, Google wants to expand its ecosystem of 35,000 devices certified to support the APIs for its Assistant service. Assistant is anchored in Google’s HomeGraph, a software construct that mines smart home data for insights.The service is “based on voice today, but the future is about contextual understanding and visuals, and that’s where more sensors come into play,” said Wendy Kam, a Google business development manager speaking at the event. “More things need to include sensors for the Assistant to offer a robust experience” that lets consumers personalize predictive services.So far, Google’s Assistant partners include Philips Hue in lighting and LG and iRobot in appliances, but “we are at the early stage of the Assistant ecosystem,” said Kam. “If you want your sensor to work with other devices, let us know the sensor and use cases so we can define traits and APIs.”Google competes with Apple, Amazon, and others to create a smart home experience. In China, Baidu was early to launch a similar effort. To date, no standards have emerged for devices to support a hybrid mix of services.Google aims to launch a home security service soon, roughly similar to Amazon’s Alexa Guard. The search giant is also driving a TensorFlow Lite initiative to put deep-learning models running on its own controller in just tens of kilobytes into low-latency embedded services that may not need to be linked to the cloud.Long term, the kinds of third-party add-on products that consumers deploy on doors and windows for security will become embedded in new homes and furnishings. “Companies come to us asking how to future-proof their businesses, and we recommend them to system integrators,” said Kam.It’s part of a broad trend of leveraging digital technology to create efficiencies and new revenue streams. “Everyone wants to move into the software-as-a-service model,” said one presenter at the event.Next page: STM, Omron move up to modules and softwareNext page: STM, Omron move up to modules and software"
AI Startup Preps Inference ChipRick Merritt,https://www.eetimes.com/document.asp?doc_id=1334862,https://m.eet.com/media/1312401/israelAI-min.png,Wireless and Networking Designline,06.26.19,"SAN JOSE, Calif. — Add NeuroBlade to the dozens of startups working on AI silicon. The Israeli company just closed a $23 million Series A, led by the founder of Check Point Software and with participation from Intel Capital.NeuroBlade is close to taping out an inference processor that it aims to sample late this year or early in 2020. Following in the footsteps of Israeli AI startup Habana, it plans a training accelerator using a similar architecture for its next generation.The startup claims that its initial chip will run several neural networks and multiple algorithms in parallel. The chip supports a full range of neural-net models with fully connected layers, including CNNs, RNNs, LSTMs, and GANs.The chip will provide similar performance on inference jobs as Intel CPUs or Nvidia GPUs at a lower cost thanks to a much smaller die, according to the company. Alternatively, it will support significantly improved performance with a similar size and cost die.NeuroBlade declined to provide any public benchmark results until chips are shipping. However, it said that it is sharing performance metrics with select customers.Founders Elad Sity, CEO, and Eliad Hillel, CTO, met while working at Solar Edge, a startup that went public making inverters and other gear for photovoltaic arrays. Both are graduates of the technology unit of the Israel Intelligence Corps.NeuroBlade got its initial start with a $4.5 million seed round in 2017 from StageOne Ventures and Grove Ventures, headed by Dov Moran, the inventor of the USB flash drive and co-founder of M-Systems.Related posts:Related posts:"
